Symbol,Description
OAIM,Oneascent International Equity ETF
OALC,Oneascent Large Cap Core ETF
OARK,Yieldmax Innovation Option Income ETF
OBE,Obsidian Energy Ltd
OBND,SPDR Loomis Sayles Opportunistic Bond ETF
OBOR,KS MSCI One Belt One Road Index ETF
OCEN,IQ Clean Oceans ETF
OCIO,ETF Series Solutions ETF
OCTD,Innovator Premium Income 10 Barrier ETF - Oct
OCTH,Innovator Premium Income 20 Barrier ETF - Oct
OCTJ,Innovator Premium Income 30 Barrier ETF - Oct
OCTQ,Innovator Premium Income 40 Barrier ETF - Oct
OCTT,Allianzim U.S. Large Cap Buffer10 Oct ETF
OCTW,Allianzim U.S. Large Cap Buffer20 Oct ETF
OCTZ,Trueshares Structured Outcome [Oct] ETF
OEF,S&P 100 Ishares ETF
OEUR,O's Europe Qlty Divd ETF
OGCP,Empire State Realty Op LP Se
OGEN,Oragenics Inc
OGIG,O's Global Internet Giants ETF
OIH,Vaneck Oil Services ETF
OILD,Microsectors Oil & Gas Exp. & Prod -3X ETN
OILK,Crude Oil Strategy K-1 Free ETF
OILU,Microsectors Oil & Gas Exp. & Prod. 3X ETN
OMFL,Oppenheimer Russell 1000 Multifactor ETF
OMFS,Oppenheimer Russell 2000 Multifactor ETF
OND,Proshares On-Demand ETF
ONEO,Russell 1000 Momentum Focus ETF SPDR
ONEV,Russell 1000 Low Vol ETF SPDR
ONEY,Russell 1000 Yield Focus ETF SPDR
ONLN,Online Retail ETF
ONOF,GX Adaptive U.S. Risk Management ETF
OOTO,Travel & Vacation Bull 2X ETF Direxion
OPER,Clearshares Ultra-Short Maturity ETF
OPPX,Corbett Road Tactical Opportunity ETF
OPTT,Ocean Power Tech Inc
ORLA,Orla Mining
OSCV,Opus Small Cap Value Plus ETF
OSEA,Harbor International Compounders ETF
OUNZ,Vaneck Merk Gold Trust
OUS.X,Ouster Inc WT [Oust/Wa]
OUSA,O's U.S. Qlty Divd ETF
OUSM,O's Russell Smallcap Qlty Divd ETF
OVB,Overlay Shares Core Bond ETF
OVF,Overlay Shares Foreign Equity ETF
OVL,Overlay Shares Large Cap Equity ETF
OVLH,Overlay Shares Hedged Large Cap Equity ETF
OVM,Overlay Shares Municipal Bond ETF
OVS,Overlay Shares Small Cap Equity ETF
OVT,Overlay Shares Short-Term Bond ETF
OWNS,Impact Shares Affordable Housing MBS ETF
OZ,Belpointe Prep Llc Cl A Units
PAAA,PGIM AAA Clo ETF
PAB,PGIM Active Aggregate Bond ETF
PAK,GX MSCI Pakistan ETF
PALC,Pacer Large Cap Multi-Factor Alternator ETF
PALL,Physical Palladium ETF
PAMC,Pacer Lunt Midcap Multi-Factor Alternator ETF
PAPI,Parametric Equity Premium Income ETF
PAPL,Pineapple Financial Inc
PAPR,Innovator U.S. Power Buffer ETF - Apr
PAUG,Innovator U.S. Power Buffer ETF - Aug
PAVE,GX U.S. Infrastructure Development ETF
PAWZ,Pet Care ETF
PBD,Global Clean Energy Invesco ETF
PBDC,Putnam Bdc Income ETF
PBE,Dynamic Biotechnology & Genome Invesco ETF
PBJ,Dynamic Food & Beverage Invesco ETF
PBL,PGIM Portfolio Ballast ETF
PBP,S&P 500 Buywrite Invesco ETF
PBTP,Purebetasm 0-5 Yr US TIPS Invesco ETF
PBUS,Purebetasm MSCI USA Invesco ETF
PBW,Wilderhill Clean Energy Invesco ETF
PCEF,CEF Income Composite Invesco ETF
PCG-A,Pacific Gas El 6.00
PCG-B,Pacific Gas El 5.50
PCG-C,Pacific Gas El 5.00
PCG-D,Pacific Gas El 5.00
PCG-E,Pacific Gas El 5.00
PCG-G,Pacific Gas El 4.80
PCG-H,Pacific Gas El 4.50
PCG-I,Pacific Gas El 4.36
PCGG,Polen Capital Global Growth ETF
PCRB,Putnam ESG Core Bond ETF
PCY,Emrg Mkts Sovereign Debt Invesco ETF
PDEC,Innovator U.S. Power Buffer ETF - Dec
PDN,FTSE RAFI Dev Markets Ex-U.S. Small-Mid Invesco
PED,Pedevco Corp
PEJ,Dynamic Leisure and Entertainment Invesco ETF
PEMX,Putnam Emerging Markets Ex-China ETF
PEX,Global Listed Private Equity ETF
PEXL,Pacer US Export Leaders ETF
PFEB,Innovator U.S. Power Buffer ETF - Feb
PFFA,Virtus Infracap U.S. Preferred Stock ETF
PFFD,GX U.S. Preferred ETF
PFFL,Etracs 2X Prfd Stock Index ETN
PFFR,Infracap REIT Preferred ETF
PFFV,GX Variable Rate Preferred ETF
PFIG,Fundamental Investment Grade Corp Bond Invesco
PFIX,Simplify Interest Rate Hedge ETF
PFLD,Aam Low Duration Preferred and Income Securities
PFRL,PGIM Floating Rate Income ETF
PFUT,Putnam Sustainable Future ETF
PFXF,Vaneck Prfd Securities Ex Financials ETF
PGAL,GX MSCI Portugal ETF
PGF,Financial Preferred Invesco ETF
PGHY,Global Short-Term Hi-Yld Bond Invesco ETF
PGRO,Putnam Focused Large Cap Growth ETF
PGX,Preferred Invesco ETF
PHB,Fundamental Hi-Yld Corp Bond Invesco ETF
PHDG,S&P 500 Downside Hedged Invesco ETF
PHEQ,Parametric Hedged Equity ETF
PHG.U,Biomx Inc [Phge.U]
PHGE,Biomx Ltd
PHYD,Putnam ESG High Yield ETF
PHYL,PGIM Active High Yield Bond ETF
PHYS,Sprott Physical Gold Trust ETV
PICB,Intl Corp Bond Invesco ETF
PICK,Ishares Global Select Metals & Mining Fund
PIFI,Clearshares Piton Intermediate ETF
PILL,Pharmaceutical & Medical Bull 3X Direxion ETF
PIN,India Invesco ETF
PINK,Simplify Health Care ETF
PIT,Vaneck Commodity Strategy ETF
PJAN,Innovator U.S. Power Buffer ETF - Jan
PJFG,PGIM Jennison Focused Growth ETF
PJFV,PGIM Jennison Focused Value ETF
PJP,Dynamic Pharmaceuticals Invesco ETF
PJUL,Innovator U.S. Power Buffer ETF - Jul
PJUN,Innovator U.S. Power Buffer ETF - Jun
PKB,Dynamic Building & Construction Invesco ETF
PLAG,Planet Green Holdings Corp
PLDR,Putnam Sustainable Leaders ETF
PLG,Platinum Group Metals Ltd
PLM,Polymet Mining
PLTM,Graniteshares Platinum Shares ETF
PLX,Protalix Biotherapeutics
PMAR,Innovator U.S. Power Buffer ETF - Mar
PMAY,Innovator U.S. Power Buffer ETF - May
PNOV,Innovator U.S. Power Buffer ETF - Nov
POCT,Innovator U.S. Power Buffer ETF - Oct
POL,Polished.com Inc.
POWA,Invesco Bloomberg Pricing Power ETF
PP,Tidal Meet Kevin Pricing Power ETF
PPA,Aerospace & Defense Invesco ETF
PPEM,Putnam ESG Emerging Markets Equity ETF
PPI,Axs Astoria Inflation Sensitive ETF
PPIE,Putnam ESG International Equity ETF
PPLT,Physical Platinum ETF
PPTY,Ppty U.S. Diversified Real Estate ETF
PQDI,Principal Spectrum Tax-Advantaged Dividend ETF
PRAY,Fis Biblically Responsible Risk Managed ETF
PREF,Principal Spectrum Preferred Securities ETF
PRF,FTSE RAFI US 1000 Invesco ETF
PRFD,Pimco Preferred & Capital Securities Active ETF
PRK,Park National Corp
PRNT,3D Printing ETF
PSCJ,Pacer Swan Sos Conservative [Jul] ETF
PSCQ,Pacer Swan Sos Conservative [Oct] ETF
PSCW,Pacer Swan Sos Conservative [Apr] ETF
PSCX,Pacer Swan Sos Conservative [Dec] ETF
PSDM,PGIM Short Duration Multi-Sector Bond ETF
PSEP,Innovator U.S. Power Buffer ETF - Sep
PSFD,Pacer Funds ETF
PSFF,Pacer Swan Sos Fund of Funds ETF
PSFJ,Pacer Swan Sos Flex [Jul] ETF
PSFM,Pacer Swan Sos Flex [Apr] ETF
PSFO,Pacer Swan Sos Flex [Oct] ETF
PSI,Dynamic Semiconductors Invesco ETF
PSIL,Advisorshares Psychedelics ETF
PSK,SPDR ICE Preferred Securities ETF
PSLV,Sprott Physical Silver Trust ETV
PSMD,Pacer Swan Sos Moderate [Dec] ETF
PSMJ,Pacer Swan Sos Moderate [Jul] ETF
PSMO,Pacer Swan Sos Moderate [Oct] ETF
PSMR,Pacer Swan Sos Moderate [Apr ETF
PSP,Global Listed Private Equity Invesco ETF
PSQ,Short QQQ -1X ETF
PSR,Active U.S. Real Estate Invesco ETF
PST,Ultrashort Lehman 7-10 Year Treasury -2X ETF
PSTP,Innovator Power Buffer Step-Up Strategy ETF
PTBD,Pacer Trendpilot US Bond ETF
PTEU,Pacer Trendpilot European Index ETF
PTIN,Pacer Trendpilot International ETF
PTLC,Pacer Trendpilot 750 ETF
PTMC,Pacer Trendpilot 450 ETF
PTN,Palatin Technologies
PTRB,PGIM Total Return Bond ETF
PULS,PGIM Ultra-Short Bond ETF
PULT,Putnam ESG Ultra Short ETF
PUTD,CBOE Validus S&P 500 Dynamic Putwrite ETF
PUTW,Wisdomtree CBOE S&P 500 Putwrite Strategy Fund
PVAL,Putnam Focused Large Cap Value ETF
PVI,Vrdo Tax-Free Weekly Invesco ETF
PW,Power REIT
PW-A,Power REIT 7.75% Series A Cumul
PWB,Dynamic Large Cap Growth Invesco ETF
PWS,Pacer Wealthshield ETF
PWV,Dynamic Large Cap Value Invesco ETF
PWZ,California Amt-Free Municipal Bond Invesco ETF
PXE,Ynamic Energy Exploration & Production ETF
PXF,FTSE RAFI Dev Markets Ex-U.S. Invesco ETF
PXH,FTSE RAFI Emrg Markets Invesco ETF
PXJ,Dynamic Oil & Gas Services Invesco ETF
PYLD,Pimco Multisector Bond Active ETF
PYPY,Yieldmax Pypl Option Income ETF
PZA,National Amt-Free Municipal Bond Invesco ETF
PZG,Paramount Gold and Silver
PZT,New York Amt-Free Municipal Bond Invesco ETF
QAI,IQ Hedge Multi-Strategy Tracker ETF
QARP,Xt Russell 1000 US Quality Reasonable Price ETF
QCON,American Century Convertible Securities ETF
QDEC,FT Growth-100 Buffer ETF December
QDEF,Flexshares Quality Div Def Fund
QDF,Flexshares Quality Div Fund
QDIV,GX S&P 500 Quality Dividend ETF
QDPL,Pacer Metaurus US Large Cap Divd Multiplier 400
QEFA,SPDR MSCI EAFE Strategic Factors ETF
QEMM,EM Strategicfactors MSCI ETF SPDR
QFTA,Quantum Fintech Acquisition Corp
QGRO,American Century Stoxx U.S. Quality Growth ETF
QGRW,Wisdomtree U.S. Quality Growth Fund
QID,Ultrashort QQQ -2X ETF
QINT,American Century Quality Diversified Intl ETF
QIS,Simplify Multi-Qis Alternative ETF
QJUN,FT CBOE Vest Growth-100 Buffer
QLC,Flexshares US Quality Largecap ETF
QLD,Ultra QQQ 2X ETF
QLTA,AAA A Rated Corp Bond Ishares ETF
QLTY,GMO U.S. Quality ETF
QLV,Flexshares US Quality Low Volatility Index Fund
QLVD,Flexshares Dvld Markets Ex-US Qlty Low Vol ETF
QLVE,Flexshares EM Quality Low Vol ETF
QMAR,FT Growth-100 Buffer ETF March
QMOM,Quantitative Momentum ETF
QPFF,American Century Quality Preferred ETF
QPX,Advisorshares Q Dynamic Growth ETF
QQH,Hcm Defender 100 Index ETF
QRFT,Qraft Ai-Enhanced U.S. Large Cap ETF
QSPT,FT Nasdaq-100 Buffer ETF September
QSWN,Amplify Blackswan Tech & Treasury ETF
QTAP,Innovator Growth Accelerated Plus ETF - Apr
QTJA,Innovator Growth Accelerated Plus ETF - Jan
QTJL,Innovator Growth Accelerated Plus ETF - Jul
QTOC,Innovator Growth Accelerated Plus ETF - Oct
QTUM,Defiance Quantum ETF
QUAL,USA Quality Factor Ishares Edge MSCI ETF
QULL,Etracs 2X MSCI US Quality Factor TR ETF
QUS,USA Qlty Mix MSCI ETF SPDR
QUVU,Hartford Quality Value ETF
QVAL,US Quantitative Valueshares ETF
QVML,Invesco S&P 500 Qvm Multi-Factor ETF
QVMM,Invesco S&P Midcap 400 Qvm Multi-Factor ETF
QVMS,Invesco S&P Smallcap 600 Qvm Multi-Factor ETF
QVOY,Q3 All-Season Active Rotation ETF
QWLD,World Qlty Mix MSCI ETF SPDR
RAAX,Vaneck Inflation Allocation ETF
RAFE,Pimco RAFI ESG U.S. ETF
RATE,GX Interest Rate Hedge ETF
RAVI,Flexshares Ready Access Variable Income
RAYC,Rayliant Quantamental China Equity ETF
RAYD,Rayliant Quantitative Developed Market Equity Et
RAYE,Rayliant Quantamental Emerging Market Equity ETF
RBLD,FT Alerian US Nextgen Infrastructure ETF
RCG,Renaissance Capital Growth & Income Fund III
RDFI,Rareview Dynamic Fixed Income ETF
RDIV,Ultra Dividend Revenue ETF Oppenheimer
RDOG,Alps REIT Dividend Dogs ETF
RDVI,FT Rising Dividend ETF
RECS,Columbia Research Enhanced Core ETF
REET,Global REIT Ishares ETF
REGL,S&P Midcap 400 Dividend Aristocrats ETF
REI,Ring Energy Inc
REK,Short Real Estate -1X ETF
REM,Mortgage Real Estate Ishares ETF
REMX,Vaneck Rare Earth Strategic Metals ETF
RENW,Harbor Energy Transition Strategy ETF
REPX,Riley Exploration Permian Inc
RESD,Wisdomtree International ESG Fund
RESE,Wisdomtree Emerging Markets ESG Fund
RESI,Kelly Residential & Apartment Real Estate ETF
RESP,Wisdomtree U.S. ESG Fund
RETL,Retail Bull 3X Direxion
REVS,Columbia Research Enhanced Value ETF
REW,Ultrashort Technology -2X ETF
REZ,Residential and Multisector Real Estate ETF
RFCI,Riverfront Core Income Fund ETF FT
RFDA,Riverfront US Dividend Adv ETF FT
RFFC,Riverfront US Flex-Cap ETF FT
RFG,S&P Midcap 400 Pure Growth Invesco ETF
RFV,S&P Midcap 400 Pure Value Invesco ETF
RHCB,BNY Mellon Responsible Horizons Corp Bond ETF
RHE,Regional Health Properties
RHE-A,Regional Health Properties 10.875% Series A
RHRX,Roundhill Tactical Rotation ETF
RHTX,Roundhill Tactical Outlook ETF
RIET,Hoya Capital High Dividend Yield ETF
RIGS,Riverfront Strategic Income Fund ETF
RINC,Axs Real Estate Income ETF
RINF,Inflation Expectations ETF
RISN,Inspire Tactical Balanced ESG ETF
RISR,Foliobeyond Rising Rates ETF
RITA,ETF Series Etfb Green Sri Reits ETF
RLGT,Radiant Logistics
RLY,SSGA Multi-Asset Real Return ETF SPDR
RMIF,Solutions Lha Risk-Managed Income ETF
RNWZ,Eagle Global Renewable Energy Income ETF
ROAM,Hartford Multifactor Emerging Markets ETF
ROBO,Global Robotics and Automation ETF
RODE,Hartford Multifactor Diversified Intl ETF
RODM,Hartford Multifactor Dev Markets [Ex-Us] ETF
ROKT,SPDR Kensho Final Frontiers ETF
ROM,Ultra Technology 2X ETF
ROMO,Strategy Shares Newfound/Resolve Robust Momentum
ROOF,IQ US Real Estate Smallcap ETF
RORO,Atac US Rotation ETF
ROSC,Hartford Multifactor Small Cap ETF
ROUS,Hartford Multifactor U.S. Equity ETF
ROYA,Tema Global Royalties ETF
RPAR,Rpar Risk Parity ETF
RPG,S&P 500 Pure Growth Invesco ETF
RPHS,Regents Park Hedged Market Strategy ETF
RPV,S&P 500 Pure Value Invesco ETF
RSBT,Return Stacked Bonds & Managed Futures ETF
RSEE,Rareview Systematic Equity
RSHO,Tema American Reshoring ETF
RSP,S&P 500 EW Invesco ETF
RSPC,Invesco S&P 500 EW Comm Services ETF
RSPD,S&P 500 EW Consumer Discretionary Invesco ETF
RSPE,Invesco ESG S&P 500 Equal Weight ETF
RSPF,S&P 500 EW Financials Invesco ETF
RSPG,S&P 500 EW Energy Invesco ETF
RSPH,S&P 500 EW Health Care Invesco ETF
RSPM,S&P 500 EW Materials Invesco ETF
RSPN,S&P 500 EW Industrials Invesco ETF
RSPR,S&P 500 EW Real Estate Invesco ETF
RSPS,S&P 500 EW Consumer Staples Invesco ETF
RSPT,S&P 500 EW Technology Invesco ETF
RSPU,S&P 500 EW Utilities Invesco ETF
RSST,Tidal U.S. Stocks & Managed Futures ETF
RTAI,Rareview Tax Advantaged Income ETF
RUFF,Alpha Dog ETF
RULE,Adaptive Core ETF
RVNU,Xt Municipal Infrastructure Revenue Bond ETF
RVP,Retractable Technologies
RVRB,Advisorshares Reverb ETF
RWJ,Smallcap Revenue ETF Oppenheimer
RWK,Midcap Revenue ETF Oppenheimer
RWL,Largecap Revenue ETF Oppenheimer
RWM,Short Russell 2000 -1X ETF
RWO,DJ Global Real Estate ETF SPDR
RWR,DJ REIT ETF SPDR
RWX,DJ Intl Real Estate ETF SPDR
RXD,Ultrashort Health Care -2X ETF
RXI,Global Cons Disc Ishares ETF
RXL,Ultra Health Care 2X ETF
RYJ,Raymond James Sb-1 Equity Invesco ETF
RYLD,GX Russell 2000 Covered Call ETF
RYLG,GX Russell 2000 Covered Call & Growth ETF
RYSE,CBOE 10-Year Interest Rate Hedge ETF
RZG,S&P Smallcap 600 Pure Growth Invesco ETF
RZV,S&P Smallcap 600 Pure Value Invesco ETF
SAA,Ultra Smallcap600 2X ETF
SAC-A,Sachem Capital Corp
SACC,Sachem Capital Corp 6.875% Notes Due 2024
SACH,Sachem Capital Corp
SAEF,Schwab Strategic Ariel ESG ETF
SAGP,Strategas Global Policy Opportunities ETF
SAMT,Strategas Macro Thematic Opportunities ETF
SANE,Subversive Mental Health ETF
SAT.X,Satixfy Communications WT [Satx.Ws.A]
SATO,Invesco Alerian Galaxy Crypto Economy ETF
SATX,Satixfy Communications Ltd Ordinary Share
SAUG,FT CBOE Vest U.S. Small Cap Moderage ETF Aug
SBB,Short Smallcap600 -1X ETF
SBE.W,Splash Beverage Group WT [Sbev/W]
SBEV,Splash Beverage Group Inc
SBIO,Alps Medical Breakthroughs ETF
SBND,Columbia Short-Duration Bond ETF
SCC,Ultrashort Consumer Services -2X ETF
SCCB,Sachem Capital Corp
SCCC,Sachem Capital Corp 7.75% Notes Due 2025
SCCD,Sachem Capital Corp 6.00%
SCCE,Sachem Capital Corp 6.00% Notes Due 2027
SCCF,Sachem Capital Corp. 7.125% Notes Due 2027
SCCG,Sachem Capital Corp. 8.00% Notes Due 2027
SCDL,Etracs 2X US Dividend Factor TR ETN
SCHA,Schwab U.S. Smallcap ETF
SCHB,Schwab U.S. Broad Market ETF
SCHC,Schwab Intl Smallcap Equity ETF
SCHD,Schwab US Dividend Equity ETF
SCHE,Schwab Emrg Mkts Equity ETF
SCHF,Schwab Intl Equity ETF
SCHG,Schwab U.S. Largecap Growth ETF
SCHH,Schwab U.S. REIT ETF
SCHI,Schwab 5-10 Year Corp Bond ETF
SCHJ,Schwab 1-5 Year Corp Bond ETF
SCHK,Schwab 1000 Index ETF
SCHM,Schwab U.S. Mid Cap ETF
SCHO,Schwab Short-Term U.S. Treasury ETF
SCHP,Schwab U.S. TIPS ETF
SCHQ,Schwab Long-Term U.S. Treasury ETF
SCHR,Schwab Int-Term U.S. Treasury ETF
SCHV,Schwab U.S. Largecap Value ETF
SCHX,Schwab U.S. Largecap ETF
SCHY,Schwab International Dividend Equity ETF
SCHZ,Schwab US Aggregate Bond ETF
SCJ,Japan Smallcap Ishares MSCI ETF
SCMB,Schwab Strategic Municipal Bond ETF
SCO,Ultrashort Bloomberg Crude Oil -2X ETF
SCRD,Janus Sustainable Corporate Bond ETF
SCYB,Schwab High Yield Bond ETF
SDCI,Uscf Summerhaven Dynamic Commodity Strategy No K
SDCP,Virtus Newfleet Short Duration Core Plus Bonus E
SDD,Ultrashort Smallcap600 -2X ETF
SDEM,GX MSCI Superdividend EM ETF
SDIV,GX Superdividend ETF
SDOG,Alps Sector Dividend Dogs ETF
SDOW,Ultrapro Short Dow 30 -3X ETF
SDP,Ultrashort Utilities -2X ETF
SDPI,Superior Drilling Products Inc
SDS,Ultrashort S&P500 -2X ETF
SDVD,FT Rising Dividend Achievers Target ETF
SDY,S&P Dividend SPDR
SEA,U.S. Global Sea To Sky Cargo ETF
SEB,Seaboard Corp
SECT,Northern IV Main Sector Rotation ETF
SEF,Short Financials -1X ETF
SEIM,Sei Enhanced U.S. Large Cap Momentum Factor ETF
SEIQ,Sei Enhanced U.S. Large Cap Quality ETF
SEIV,Sei Exchange Traded Fds Sei Enhanced U.S. Large
SEIX,Virtus Seix Senior Loan ETF
SELV,Sei Enhanced Low Volatility U.S. Large Cap ETF
SEMI,Columbia Seligman Semiconductor and Tech ETF
SENS,Senseonics Holdings
SEPT,Allianzim U.S. Large Cap Buffer10 Sep ETF
SEPW,Allianzim U.S. Large Cap Buffer20 Sep ETF
SEPZ,Listed Trueshares Structured Outcome [Sep] ETF
SESG,Sprott ESG Gold ETF Units Beneficial Interest
SETH,Proshares Short Ether Strategy ETF
SFIG,Wisdomtree U.S. Short-Term Corp Bond Fund
SFLR,Innovator Equity Managed Floor ETF
SFY,Sofi Select 500 ETF
SFYF,Sofi 50 ETF
SFYX,Sofi Next 500 ETF
SGDJ,Alps Sprott Junior Gold
SGDM,Sprott Gold Miners ETF
SGE,Strong Global Entertainment Cl A
SGLC,The Rbb Fund Inc Sgi U.S. Large Cap Core ETF
SGN,Signing Day Sports Inc
SGOL,Physical Gold ETF
SGOV,Ishares 0-3 Month Treasury Bond ETF
SH,Short S&P500 -1X ETF
SHAG,Wisdomtree Yield Enhd U.S. Short-Term Agg Bond
SHDG,Soundwatch Hedged Equity ETF
SHE,SSGA Gender Diversity ETF SPDR
SHLD,GX Defense Tech ETF
SHM,Short-Term Muni Bond ETF SPDR
SHNY,Microsectors Gold 3X Leveraged ETN
SHOC,Ea Series Strive U.S. Semiconductor ETF
SHPP,Pacer Industrials and Logistics ETF
SHRT,Gotham Short Strategies ETF
SHUS,Syntax Stratified U.S. Total Market Hedged ETF
SHYD,Vaneck Short High Yield Muni ETF
SHYG,0-5 Year High Yield Corp Bond Ishares ETF
SHYL,Xt Short-Duration High Yield Bond ETF
SIF,Sifco Industries
SIFI,Harbor Scientific Alpha Income ETF
SIHY,Harbor Scientific Alpha High-Yield ETF
SIJ,Ultrashort Industrials -2X ETF
SIL,GX Silver Miners ETF
SILJ,ETFMG Prime Junior Silver Miners ETF
SILV,Silvercrest Metals Inc
SIM,Grupo Simec S.A. DE C.V. ADR
SIMS,SPDR Kensho Intelligent Structures ETF
SIO,Touchstone Strategic Income Opportunities ETF
SIVR,Physical Silver ETF
SIXA,6 Meridian Mega Cap Equity ETF
SIXH,6 Meridian Hedged Eqty Idx Option Strategy ETF
SIXJ,Aim U.S. Large Cap 6 Month Buffer10 Jan/Jul ETF
SIXL,6 Meridian Low Beta Equity Strategy ETF
SIXO,Allianzim U.S. Large Cap 6M Buffer10 Apr/Oct
SIXS,6 Meridian Small Cap Equity ETF
SIZE,USA Size Factor Ishares Edge MSCI ETF
SJB,Short High Yield -1X ETF
SJIM,Jim Cramer Inverse Tracker ETF
SJNK,SPDR Bloomberg Short Term High Yield Bond ETF
SKF,Ultrashort Financials -2X ETF
SKY.W,Sky Harbour Group Corp WT [Skyh.W]
SKYH,Sky Harbour Group Corp
SLI,Standard Lithium Ltd
SLN.W,Southland Holdings Inc WT [Slnd.W]
SLND,Southland Holdings Inc
SLV,Silver Trust Ishares
SLVP,Ishares Global Silver Miners Fund
SLX,Vaneck Steel ETF
SLYG,S&P Smallcap Growth ETF SPDR
SLYV,S&P Smallcap Value ETF SPDR
SMAY,FT U.S. Small Cap Moderate Buffer ETF - May
SMB,Vaneck Short Muni ETF
SMDD,Ultrapro Short Midcap 400 -3X ETF
SMDV,Russell 2000 Dividend Growers ETF
SMDY,Syntax Stratified Midcap ETF
SMHB,Etracs 2X Small Cap HI Div ETN
SMI,Vaneck Hip Sustainable Muni ETF
SMIG,Aam Bahl Small/Mid Cap Income Growth ETF
SMIN,India Smallcap Ishares MSCI ETF
SMIZ,Zacks Trust Zacks Small/Mid Cap ETF
SMLE,Xt S&P Smallcap 600 ESG ETF
SMLF,USA Multifactor Smallcap Ishares Edge MSCI ETF
SMLV,SSGA US Smallcap Low Vol Index SPDR
SMMD,Russell 2500 Ishares ETF
SMMU,Short-Term Muni Bond Strgy Pimco ETF
SMMV,USA Min Vol Smallcap Ishares Edge MSCI ETF
SMN,Ultrashort Basic Materials -2X ETF
SMOG,Vaneck Low Carbon Energy ETF
SMOT,Vaneck Morningstar Smid Moat ETF
SNAV,Mohr Sector Navigator ETF
SNMP,Evolve Transition Infrastructure LP
SNOV,FT CBOE Vest U.S. Small Cap ETF - Nov
SNPD,Dbx S&P ESG Dividend Aristocrats ETF
SNPE,Xt S&P 500 ESG ETF
SNPG,Dbx S&P 500 Growth ESG ETF
SNPV,Dbx S&P ESG Value ETF
SOF,Amplify Samsung SOFR ETF
SOLR,Smartetfs Sustainable Energy II ETF
SOVF,Sovereign's Capital Flourish Fund
SOXL,Semiconductor Bull 3X Direxion
SOXS,Semiconductor Bear -3X Direxion
SOYB,Teucrium Soybean
SPAB,SPDR Aggregate Bond Portfolio ETF
SPAX,Robinson Alternative Yield Pre-Merger Spac ETF
SPBO,Issuer Scd Corp Bond SPDR
SPCZ,Rivernorth Enhanced Pre-Merger Spac ETF
SPD,Simplify US Equity Plus Downside
SPDG,SPDR Portfolio S&P Sector Neutral Dividend ETF
SPDN,S&P 500 Bear -1X Direxion
SPDV,Aam S&P 500 High Dividend Value ETF
SPDW,SPDR World Ex-US Portfolio ETF
SPEM,SPDR Emerging Markets Portfolio ETF
SPEU,Stoxx Europe 50 SPDR
SPFF,GX Superincome Preferred ETF
SPGM,SPDR Portfolio MSCI Global Stock Market ETF
SPGP,Invesco S&P 500 Garp ETF
SPHB,S&P 500 High Beta Invesco ETF
SPHD,S&P 500 High Dividend Low Vol Invesco ETF
SPHQ,S&P 500 Quality Invesco ETF
SPHY,SPDR Portfolio High Yield Bond ETF
SPIB,SPDR Intermediate Term Corporate Bond Portfolio
SPIP,TIPS Barclays ETF SPDR
SPKX,Convexityshares 1X SPIKES Futures ETF
SPKY,Convexityshares 1.5X SPIKES Futures ETF
SPLB,SPDR Long Term Corporate Bond Portfolio ETF
SPLG,SPDR Portfolio S&P 500 ETF
SPLV,S&P 500 Low Vol Invesco ETF
SPMB,Mortgage Backed Bond ETF SPDR
SPMD,SPDR Mid Cap Portfolio ETF
SPMO,S&P 500 Momentum Invesco ETF
SPMV,S&P 500 Minimum Variance Invesco ETF
SPPP,Sprott Physical Platinum and Palladium
SPQ,Simplify US Equity Plus Qis ETF
SPRE,SPDR S&P Global REIT Sharia ETF
SPSB,SPDR Short-Term Corporate Bond Portfolio ETF
SPSK,Tidal SP Funds Dow Jones Global Sukuk ETF
SPSM,SPDR Small Cap Portfolio ETF
SPTI,Interm Term Treasury ETF SPDR
SPTL,SPDR Long Term Treasury Portfolio ETF
SPTM,SPDR Total Stock Market Portfolio ETF
SPTS,SPDR Short-Term Treasury Portfolio ETF
SPUC,Simplify US Equity Plus Upside ETF
SPUS,SPDR S&P 500 Sharia Industry Exclusions ETF
SPUU,S&P 500 Bull 2X ETF Direxion
SPVM,Invesco S&P 500 Value With Momentum ETF
SPVU,S&P 500 Enhanced Value Invesco ETF
SPXB,S&P 500 Bond ETF
SPXE,S&P 500 Ex-Energy ETF
SPXL,S&P 500 Bull 3X Direxion
SPXN,S&P 500 Ex-Financials ETF
SPXS,S&P 500 Bear -3X Direxion
SPXT,S&P 500 Ex-Technology ETF
SPXU,Ultrapro Short S&P500 -3X ETF
SPXV,S&P 500 Ex-Health Care ETF
SPY,S&P 500 SPDR
SPYC,Simplify US Equity Plus Convexity
SPYD,SPDR S&P 500 High Dividend Portfolio ETF
SPYG,SPDR S&P 500 Growth Portfolio ETF
SPYI,Shp Neos S&P 500 High Income ETF
SPYV,SPDR S&P 500 Value Portfolio ETF
SPYX,S&P 500 Ex-Fossil Fuel ETF SPDR
SQEW,Leadershares Equity Skew ETF
SQY,Yieldmax Sq Option Income ETF
SRHQ,Elevation Series Srh U.S. Quality ETF
SRHR,Srh REIT Covered Call ETF
SRLN,Blackstone Gso Senior Loan SPDR
SROI,Calamos Antetokounmpo Global Sustainable ETF
SRS,Ultrashort Real Estate -2X ETF
SRTY,Ultrapro Short Russell 2000 -3X ETF
SRVR,Pacer Benchmark & Infrastructure Real Estate ETF
SSFI,Day Hagan Smart Sector Fixed Income ETF
SSG,Ultrashort Semiconductors -2X ETF
SSLY,Syntax Stratified Smallcap ETF
SSO,Ultra S&P500 2X ETF
SSPX,Janus U.S. Sustainable Equity ETF
SSPY,Syntax Stratified Largecap ETF
SSUS,Day Hagan Research Smart Sector ETF
SSXU,Smart Sector International ETF
SSY,Sunlink Health Systems
STCE,Schwab Crypto Thematic ETF
STGF,Listed Funds Merk Stagflation ETF
STIP,0-5 Year TIPS Bond Ishares ETF
STLG,Ishares Factors US Growth Style ETF
STLV,Ishares Factors US Value Style ETF
STNC,Stance Equity ESG Large Cap Core ETF
STOT,SPDR Doubleline Short-Duration TR Tactical ETF
STPZ,1-5 Year US TIPS Index Pimoc ETF
STRV,Ea Series Strive 500 ETF
STRW,Strawberry Fields REIT Inc
STXE,Strive Emerging Markets Ex-China ETF
STXS,Stereotaxis Inc
SUB,Short-Term Natl Muni Bond Ishares ETF
SUPL,Proshares Supply Chain Logistics ETF
SUPP,Tcw Transform Supply Chain ETF
SURE,Advisorshares Doubleline Value Equity ETF
SURI,Simplify Propel Opportunities ETF
SUSA,USA ESG Select Ishares MSCI ETF
SVAL,Ishares US Small Cap Value Factor ETF
SVIX,VS TR Short VIX -1X Futures ETF
SVM,Silvercorp Metals Inc
SVOL,Simplify Volatility Premium ETF
SVT,Servotronics Inc
SVXY,Short VIX Short-Term -1X Futures ETF
SWAN,Blackswan Growth & Treasury Core Amplify ETF
SXQG,6 Meridian Quality Growth ETF
SXUS,Janus International Sustainable Equity ETF
SYII,Syntax Stratified Total Market II ETF
SYLD,Cambria Shareholder Yield ETF
SYNB,Putnam Biorevolution ETF
SYUS,Syntax Stratified U.S. Total Market ETF
SZK,Ultrashort Consumer Goods -2X ETF
SZNE,Pacer Cfra-Stovall EW Seasonal Rotation ETF
TACK,Capitol Fairlead Tactical Sector ETF
TAFI,Ab Tax-Aware Short-Duration Municipal ETF
TAGG,T. Rowe Price Qm U.S. Bond ETF
TAGS,Teucrium Agricultural
TAIL,Cambria Tail Risk ETF
TAN,Solar Invesco ETF
TAXF,American Century Diversified Muni Bond ETF
TBF,Short 20+ Year Treasury -1X ETF
TBG,Tbg Dividend Focus ETF
TBJL,Innovator 20-Year Bond 9 Buffer ETF - Jul
TBLL,Invesco Short Term Treasury ETF
TBT,Ultrashort Lehman 20 Year Treasury -2X ETF
TBUX,T. Rowe Price Ultra-Short-Term Bond ETF
TBX,Short 7 10 Year Treasury -1X ETF
TCAF,T. Rowe Capital Appreciation Equity ETF
TCHP,T. Rowe Price Blue Chip Growth ETF
TDTF,Iboxx 5Yr Target Dur TIPS ETF Flexshares
TDTT,Iboxx 3Yr Target Dur TIPS ETF Flexshares
TDV,S&P Technology Dividend Aristocrats ETF
TDVG,T. Rowe Price Dividend Growth ETF
TDVI,FT Technology Dividend Target ETF
TDW.W,Tidewater Inc WT
TECB,Ishares U.S. Tech Breakthrough Multisector ETF
TECL,Technology Bull 3X Direxion
TECS,Technology Bear -3X Direxion
TELL,Tellurian Inc
TELZ,Tellurian Inc 8.25% Senior Notes Due 2028
TEMP,JPM Climate Change S
TEQI,T. Rowe Price Equity Income ETF
