Symbol,Description
AAA,First Priority Clo Bond ETF
AAAU,GS Physical Gold ETF
AAMC,Altisource Asset Management Corp Com
AAPY,Neos Strategy Apple [Aapl] ETF
AAU,Almaden Minerals
ABEQ,Absolute Core Strategy ETF
ACES,Alps Clean Energy ETF
ACIO,Aptus Collared Income Opportunity ETF
ACSI,American Customer Satisfaction Core Alpha ETF
ACTV,Leadershares Activist Leaders ETF
ACU,Acme United Corp
ACVF,American Conservative Values ETF
ACWV,Ishares Global Min Vol Factor ETF
ADE.U,Adit Edtech Acquisition Corp [Adex.U]
ADE.W,Adit Edtech Acquisition Corp WT [Adex/W]
ADEX,Adit Edtech Acquisition Corp
ADFI,Anfield Dynamic Fixed Income ETF
ADIV,Smartetfs Asia Pacific Dividend Builder ETF
ADME,Aptus Drawdown Managed Equity ETF
ADPV,Adaptiv Select ETF
ADR.S,Ault Disruptive Technologies Corp [Adrt.U]
ADRT,Ault Disruptive Technologies Corp
ADVE,Matthews Asia Dividend Active ETF
AE,Adams Resources & Energy
AEF,Abrdn EM Equity Income Fund Inc
AEMB,American Century Emerging Markets Bond ETF
AEO.W,Aeon Biopharma Inc WT [Aeon.W]
AEON,Aeon Biopharma Inc
AESR,Anfield U.S. Equity Sector Rotation ETF
AETH,Bitwise Ethereum Strategy ETF
AFIF,Anfield Universal Fixed Income ETF
AFK,Vaneck Africa Index ETF
AFLG,FT Active Factor Large Cap ETF
AFMC,FT Active Factor Mid Cap ETF
AFSM,FT Active Factor Small Cap ETF
AFTY,CSOP FTSE China A50 ETF
AGE,Agex Therapeutics Inc
AGG,US Aggregate Bond Ishares Core ETF
AGGH,Simplify Aggregate Bond Plus Credit ETF
AGGY,Wisdomtree Yield Enhd U.S. Agg Bond Fund
AGIH,Ishares Inflation Hedged U.S. Aggregate Bond ETF
AGOV,Etc Gavekal Asia Pacific Government Bond ETF
AGOX,Adaptive Growth Opportunities ETF
AGQ,Ultra Silver 2X ETF
AGQI,First Trust Active Global Quality Income ETF
AGRH,Interest Rate Hedged U.S. Agg Bond ETF
AGZ,Agency Bond Ishares ETF
AHLT,American Beacon Ahl Trend ETF
AHOY,Tidal Newday Ocean Health ETF
AHYB,American Century Select High Yield ETF
AIDB,Ai-Pilot Large Cap Dynamic Beta Income ETF
AIEQ,A.I. Powered Equity ETF
AIM,Aim Immunotech Inc
AINC,Ashford Inc
AIRI,Air Industries Group Inc
AIVI,Wisdomtree International Dividend Top 100 Fund
AIVL,Wisdomtree U.S. Dividend Ex-Financials Fund
ALTL,Pacer Lunt Large Cap Alternator ETF
ALUM,Uscf Aluminum Strategy Fund
AMAX,Roundhill Hedged Multi-Asset Income ETF
AMB.V,Ambipar Emergency Response [Ambi/W]
AMBI,Ambipar Emergency Response Cl A
AMBO,Ambow Education Holding Ltd ADR
AMDY,Yieldmax Amd Option Income ETF
AMJ,Alerian MLP Index ETN JP Morgan
AMLP,Alps Alerian MLP ETF
AMNA,Etracs Alerian Midstream Energy Index ETN
AMND,UBS Ag Alerian Midstream Energy High Div ETF
AMOM,Qraft Ai-Enhanced U.S. Large Cap Momentum ETF
AMPD,Cnic Carbon Neutral Power Futures ETF
AMPE,Ampio Pharmaceuticals
AMS,American Shared Hospital Services
AMTR,Etracs Alerian Midstream Energy TR ETN
AMUB,Etracs Alerian MLP Index ETN Series B
AMZA,Infracap MLP ETF
AMZP,Neos Yield Premium Strategy Amazon [Amzn] ETF
AMZY,Yieldmax Amzn Option Income ETF
ANEW,MSCI Transformational Changes ETF
AOA,Aggressive Allocation Ishares Core ETF
AOK,Conservative Allocation Ishares Core ETF
AOM,Moderate Allocation Ishares Core ETF
AOR,Growth Allocation Ishares Core ETF
AP.W,Ampco-Pittsburgh Corp Series A WT
APCB,Activepassive Core Bond ETF
APIE,Activepassive International Equity ETF
APLY,Yieldmax Aapl Option Income ETF
APMU,Activepassive Intermediate Municipal Bond ETF
APRD,Innovator Premium Income 10 Barrier ETF - Apr
APRH,Innovator Premium Income 20 Barrier ETF - Apr
APRJ,Innovator Premium Income 30 Barrier ETF - Apr
APRQ,Innovator Premium Income 40 Barrier ETF - Apr
APRT,Allianzim U.S. Large Cap Buffer10 Apr ETF
APRW,Allianzim U.S. Large Cap Buffer20 Apr ETF
APRZ,Trueshares Structured Outcome [Apr] ETF
APT,Alpha Pro Tech
APUE,Activepassive U.S. Equity ETF
ARB,Altshares Merger Arbitrage ETF
ARCM,Arrow Reserve Capital Management ETF
AREN,The Arena Group Holdings Inc
ARGT,GX MSCI Argentina ETF
ARKA,Ark Active Bitcoin Futures Strategy ETF
ARKC,Ark Active On-Chain Bitcoin Strategy ETF
ARKD,Ark Blockchain and Digital Economy Innov ETF
ARKF,Ark Fintech Innovation ETF
ARKG,Ark Genomic Revolution ETF
ARKK,Ark Innovation ETF
ARKQ,Ark Autonomous Tech & Robotics ETF
ARKW,Ark Next Generation Internet ETF
ARKX,Ark Space Exploration & Innovation ETF
ARKY,Ark Active Bitcoin Ethereum Strategy ETF
ARKZ,Ark Active Ethereum Futures Strategy ETF
ARMN,Aris Mining Corp
ARMP,Armata Pharmaceuticals Inc
ARMR,Armor US Equity Index ETF
ARP,Inner Circle II Pmv Adaptive Risk Parity ETF
ASEA,GX FTSE Southeast Asia ETF
ASHR,Xt Harvest CSI 300 China A-Shares ETF
ASHS,Xt Harvest CSI 500 China A-Shares Small Cap ETF
ASHX,Xt MSCI China A Inclusion Equity ETF
ASIA,Matthews Pacific Tiger Active ETF
ASM,Avino Silver & Gold
ASXC,Asensus Surgical Inc
ATE.W,Athena Technology Acquisition II WT [Atek/W]
ATEK,Athena Technology Acquisition Corp II Cl A
ATFV,Alger 35 ETF
ATMP,Barclays Plus Select MLP ETN
ATNM,Actinium Pharmaceuticals Inc
AUGT,Aim U.S. Large Cap Buffer10 Aug ETF
AUGW,Aim U.S. Large Cap Buffer20 Aug ETF
AUGZ,Trueshares Structured Outcome [Aug] ETF
AUL-D,Ault Alliance Inc Pfd D
AULT,Ault Alliance Inc
AUMN,Golden Minerals Company
AUSF,GX Adaptive U.S. Factor ETF
AUST,Austin Gold Corp
AVDE,Avantis International Equity ETF
AVDS,Avantis International Small Cap Equity ETF
AVDV,Avantis International Small Cap Value ETF
AVEE,Avantis Emerging Markets Small Cap Equity ETF
AVEM,Avantis Emerging Markets Equity ETF
AVES,Avantis Emerging Markets Value ETF
AVGE,Avantis All Equity Markets ETF
AVGV,Avantis All Equity Markets Value ETF
AVIE,Avantis Inflation Focused Equity ETF
AVIG,Avantis Core Fixed Income ETF
AVIV,Avantis International Large Cap Value ETF
AVLC,Avantis U.S. Large Cap Equity ETF
AVLV,Avantis U.S. Large Cap Value ETF
AVMA,Avantis Moderate Allocation ETF
AVMC,Avantis U.S. Mid Cap Equity ETF
AVMU,Avantis Core Municipal Fixed Income ETF
AVMV,Avantis U.S. Mid Cap Value ETF
AVNM,Avantis All International Markets Equity ETF
AVNV,Avantis All International Markets Value ETF
AVRE,Avantis Real Estate ETF
AVSC,Avantis U.S Small Cap Equity ETF
AVSD,Avantis Responsible International Equity ETF
AVSE,Avantis Responsible Emerging Markets ETF
AVSF,Avantis Short-Term Fixed Income ETF
AVSU,Avantis Responsible U.S. Equity ETF
AVUS,Avantis U.S. Equity ETF
AVUV,Avantis U.S. Small Cap Value ETF
AWAY,ETFMG Travel Tech ETF
AWEG,Alger Weatherbie Enduring Growth ETF
AWX,Avalon Holdings Corp
AZTD,Aztlan Global Stock Selection Dm Smid ETF
AZTR,Azitra Inc
BAB,Taxable Municipal Bond Invesco ETF
BACA,Berenson Acquisition Corp I Cl A
BAD,Listed B.A.D. ETF
BALI,Blackrock Advantage Large Cap Income ETF
BALT,Innovator Defined Wealth Shield ETF
BAMA,Brookstone Active ETF
BAMB,Brookstone Intermediate Bond Et
BAMD,Brookstone Dividend Stock ETF
BAMG,Brookstone Growth Stock ETF
BAMO,Brookstone Opportunities ETF
BAMU,Brookstone Ultra-Short Bond ETF
BAMV,Brookstone Value Stock ETF
BAMY,Brookstone Yield ETF
BAPR,Innovator U.S. Buffer ETF - Apr
BAR,Graniteshares Gold Trust Shares
BATL,Battalion Oil Corp
BATT,Adv Battery Metals and Materials Amplify ETF
BAUG,Innovator U.S. Buffer ETF - Aug
BBAG,JPM U.S. Aggregate Bond ETF
BBAX,JPM Betabuilders Developed Asia-Ex Japan ETF
BBC,Virtus Lifesci Biotech Clinical Trials ETF
BBCA,JPM Betabuilders Canada ETF
BBCB,JPM Corp Bond Research Enhanced ETF
BBEM,JPM Betabuilders Emerging Markets Equity ETF
BBEU,JPM Betabuilders Europe ETF
BBHY,JPM Diversified High Yield ETF
BBIB,JPM Betabuilders U.S Treasury Bond 3-10 Year ETF
BBIN,JPM Betabuilders International Equity ETF
BBIP,JPM Betabuilders U.S TIPS 0-5 Year ETF
BBJP,JPM Betabuilders Japan ETF
BBLB,JPM Betabuilders U.S Treasury Bond 20+ Year ETF
BBLU,Ea Bridgeway Blue Chip ETF
BBMC,JPM Betabuilders U.S. Mid Cap Equity ETF
BBP,Virtus Lifesci Biotech Products ETF
BBRE,JPM Betabuilders MSCI U.S. REIT ETF
BBSA,JPM Betabuilders 1-5 Year U.S. Aggregate Bond
BBSB,JPM Betabuilders U.S Treasury Bond 1-3 Year ETF
BBSC,JPM Betabuilders U.S. Small Cap Equity ETF
BBUS,JPM Betabuilders U.S. Equity ETF
BCD,All Commodity Longer Dated Strategy K-1 Free ETF
BCDF,Horizon Kinetics Blockchain Development ETF
BCHP,Principal Exchange-Traded Funds Principal Focuse
BCI,All Commodity Strategy K-1 Free ETF
BCIM,Abrdn Bloomberg Industrial Metals Strategy K-1 F
BCV,Bancroft Convertible Fund
BCV-A,Bancroft Fund Ltd
BDCX,Etracs Quarterly Pay 1.5X Bdc ETN
BDCZ,Etracs Bus Dev ETN Series B
BDEC,Innovator U.S. Buffer ETF - Dec
BDL,Flanigan's Enterprises
BDRY,Breakwave Dry Bulk Shipping ETF
BDVG,Imgp Berkshire Dividend Growth ETF
BECO,Blackrock Future Climate and Sustainable ETF
BEDZ,Advisorshares Hotel ETF
BEEP,Mobile Infrastructure Corp
BEMB,JPM Broad USD Emerging Markets Bond
BERZ,Microsectors Fang & Innovation -3X ETN
BETE,Proshares Bitcoin & Ether EW Strategy ETF
BETH,Proshares Bitcoin & Ether Mcap Weight ETF
BETZ,Roundhill Sports Betting & Igaming ETF
BFEB,Innovator U.S. Buffer ETF - Feb
BFIX,Build Bond Innovation ETF
BFOR,Barron's 400 ETF
BFTR,Blackrock Future Innovators ETF
BGI,Birks Group Inc
BGIG,ETF Series Bahl & Gaynor Income Growth ETF
BGLD,FT Gold Strategy Quarterly Buffer ETF
BHB,Bar Harbor Bankshares
BHM,Bluerock Homes Trust Inc
BHYB,Dbx USD High Yield Bb-B Ex Financials ETF
BIBL,Inspire 100 ETF
BIL,1-3 Month T-Bill Barclays Capital SPDR
BILS,SPDR Barclays 3-12 Month T-Bill ETF
BILZ,Pimco Ultra Short Government Active ETF
BINC,Blackrock Flexible Income ETF
BINV,Brandes International ETF
BIT.U,Bite Acquisition Corp [Bite.U]
BIT.W,Bite Acquisition Corp [Bite/W]
BITC,Bitwise Bitcoin Strategy Optimum Roll ETF
BITE,Bite Acquisition Corp
BITI,Proshares Short Bitcoin Strategy -1X ETF
BITO,Proshares Bitcoin Strategy ETF
BITQ,Bitwise Crypto Industry Innovators ETF
BITX,Volatility 2X Bitcoin Strategy ETF
BIV,Interm Term Bond ETF Vanguard
BIZD,Vaneck Bdc Income ETF
BJAN,Innovator U.S. Buffer ETF - Jan
BJUL,Innovator U.S. Buffer ETF - Jul
BJUN,Innovator U.S. Buffer ETF - Jun
BKAG,BNY Mellon Core Bond ETF
BKCI,BNY Concentrated International ETF
BKEM,BNY Mellon Emerging Markets Equity ETF
BKES,BNY Mellon Sustainable Global EM ETF
BKF,BRIC Ishares MSCI ETF
BKGI,BNY Mellon Global Infrastructure Income ETF
BKHY,BNY Mellon High Yield Beta ETF
BKIE,BNY Mellon International Equity ETF
BKIS,BNY Mellon Sustainable International Equity ETF
BKLC,BNY Mellon US Large Cap Core Equity ETF
BKLN,Senior Loan Invesco ETF
BKMC,BNY Mellon US Mid Cap Core Equity ETF
BKSE,BNY Mellon US Small Cap Core Equity ETF
BKTI,Bk Technologies Inc
BKUI,BNY Mellon Ultra-Short Income ETF
BKUS,BNY Mellon Sustainable US Equity ETF
BLCV,Blackrock Large Cap Value ETF
BLDG,Cambria Global Real Estate ETF
BLES,Inspire Global Hope Large Cap ETF
BLHY,Virtus Newfleet High Yield Bond ETF
BLKC,Invesco Galaxy Blockchain Users and Decentralize
BLOK,Transformational Data Sharing Amplify ETF
BLU.U,Blueriver Acquisition Corp [Blua.U]
BLU.W,Blueriver Acquisition Corp WT [Blua/W]
BLUA,Blueriver Acquisition Corp Cl A
BLV,Long Term Bond Index ETF Vanguard
BMAR,Innovator U.S. Buffer ETF - Mar
BMAY,Innovator U.S. Buffer ETF - May
BMED,Blackrock Future Health ETF
BMT.W,Bm Technologies Inc WT [Bmtx/W]
BMTX,Bm Technologies Inc
BMVP,Invesco Bloomberg Mvp Multi-Factor ETF
BNDC,Flexshares Core Select Bond Fund
BNDD,Quadratic Deflation ETF
BNDI,Neos Enhanced Income Aggregate Bond ETF
BNE,ETF Series Blue Horizon Bne ETF
BNGE,S-Network Streaming and Gaming ETF FT
BNKD,Microsectors U.S. Big Banks -3X ETN
BNKU,Microsectors U.S. Big Banks 3X ETN
BNO,US Brent Oil
BNOV,Innovator U.S. Buffer ETF - Nov
BOAT,Sonicshares Global Shipping ETF
BOCT,Innovator U.S. Buffer ETF - Oct
BOIL,Ultra Bloomberg Natural Gas 2X ETF
BOSS,GX Founder-Run Companies ETF
BOUT,Innovator Ibd Breakout Opportunities ETF
BOXX,Ea Architect 1-3 Month Box ETF
BPAY,Blackrock Future Financial and Technology ETF
BQ,Boqii Holding Ltd ADR
BRAZ,GX Brazil Active ETF
BRBS,Blue Ridge Bankshare
BRF,Vaneck Brazil Smallcap ETF
BRLN,Blackrock Floating Rate Loan ETF
BRN,Barnwell Industries
BRZU,Brazil Bull 3X Direxion
BSEP,Innovator U.S. Buffer ETF - Sep
BSMC,Brandes U.S. Small-Mid Cap Value ETF
BSR,Beacon Selective Risk ETF
BSTP,Innovator Buffer Step-Up Strategy ETF
BSV,Short-Term Bond ETF Vanguard
BTAL,US Anti-Beta Fund Mkt Neutral Quantshares
BTEK,Blackrock Future Tech ETF
BTG,B2Gold Corp
BTHM,Blackrock Future U.S. Themes ETF
BTOP,Bitwise Bitcoin and Ether EW Strategy ETF
BTR,Beacon Tactical Risk ETF
BTTR,Better Choice Company Inc
BUCK,Simplify Stable Income ETF
BUFB,Innovator Laddered Allocation Buffer ETF
BUFD,FT Fund of Deep Buffer ETF
BUFF,Innovator Laddered Allocation Power Buffer ETF
BUFG,FT Buffered Allocation Growth ETF
BUFQ,FT CBOE Vest Fund of Nasdaq ViII
BUFR,FT Fund of Buffer ETFS
BUFT,FT Buffered Allocation Defensive ETF
BUFZ,FT CBOE Vest Laddered Moderate Buf ETF
BUL,Pacer US Cash Cows Growth ETF
BULZ,Microsectors Fang & Innovation 3X ETN
BUR.W,Nuburu Inc WT [Buru.W]
BURU,Nuburu Inc
BUSA,Brandes U.S. Value ETF
BUYW,Northern IV Main Buywrite ETF
BUYZ,Franklin Disruptive Commerce ETF
BUZZ,Vaneck Social Sentiment ETF
BWEB,Bitwise Web3 ETF
BWET,Breakwave Tanker Shipping ETF
BWTG,Brendan Wood Topgun Index ETF
BWX,Intl Treasury Bond ETF SPDR
BWZ,Short-Term Intl Treasury Bond ETF SPDR
BYLD,Yield Optimized Bond Ishares ETF
BYRE,Principal Real Estate ETF
BYTE,Roundhill Io Digital Infrastructure ETF
BZQ,Ultrashort MSCI Brazil Capped -2X ETF
CALF,Pacer US Small Cap Cash Cows 100 ETF
CAML,Congress Large Cap Growth ETF
CAMX,Inner Circle Fund Cambiar Aggressive Value ETF
CANE,Teucrium Sugar
CANF,Can-Fite Biopharma Ltd ADR
CAOS,Ea Alpha Architect Tail Risk ETF
CAPE,Doubleline Shiller Cape U.S. Equities ETF
CARD,Montreal Max Auto Industry -3X ETN
CARU,Montreal Max Auto Industry 3X ETN
CARY,Angel Oak Income ETF
CATX,Perspective Therapeutics Inc
CBLS,Changebridge Capital Long/Short Equity ETF
CBOE,CBOE Global Markets Inc
CBON,Vaneck Chinaamc China Bond ETF
CBSE,Changebridge Capital Sustainable Equity ETF
CCEL,Cryo-Cell Intl Inc
CCF,Chase Corp
CCOR,Core Alternative ETF
CCRV,Ishares Commodity Curve Carry ETF
CDEI,MS US Large-Cap Diversity Equity and Inclusion E
CDX,Simplify High Yield Plus Credit ETF
CEF,Sprott Physical Gold & Silver Trust
CEFD,Etracs Monthly Pay 1.5X ETN
CEFS,Exchange Listed Funds Trust ETF
CEI,Camber Energy Inc
CEMB,Emrg Mkts Corp Bond Ishares JPM ETF
CET,Central Securities Corp
CETF,Drivewealth ICE 100 Index ETF
CEV,Eaton Vance California Muni Income Trust
CEW,Wisdomtree Emerging Currency Strategy Fund
CFCV,Clearbridge Focus Value ETF
CGBL,Capital Group Core Balanced ETF
CGCB,Capital Group Core Bond ETF
CGCP,Capital Group Fixed Income ETF Trust
CGDG,Capital Group Dividend Grower ETF
CGDV,Capital Dividend Value ETF
CGGO,Capital Global Growth Equity ETF
CGGR,Capital Growth ETF
CGIE,Capital Group International ETF
CGMS,Capital Group U.S. Multi-Sector ETF
CGMU,Capital Group Municipal Income ETF
CGRO,Corevalues Alpha Greater China Growth ETF
CGSD,Capital Group Short-Duration Income ETF
CGSM,Capital Group Short Duration Muni Income ETF
CGUS,Capital Core Equity ETF
CGV,Affinity Conductor Global Equity Value ETF
CGW,S&P Global Water Index Invesco ETF
CGXU,Capital Intl Focus Equity ETF
CHAA,Catcha Investment Corp Cl A
CHAT,Roundhill Generative Ai & Technology ETF
CHAU,CSI 300 China A 2X ETF Direxion
CHGX,Diversified U.S. Large Cap Fossil Fuel ETF
CHIC,GX MSCI China Communication Services ETF
CHIE,GX MSCI China Energy ETF
CHIH,GX MSCI China Health Care ETF
CHII,GX MSCI China Industrials ETF
CHIK,GX MSCI China Information Technology ETF
CHIM,GX MSCI China Materials ETF
CHIQ,GX MSCI China Consumer Discretionary ETF
CHIR,GX MSCI China Real Estate ETF
CHIS,GX MSCI China Consumer Staples ETF
CHIU,GX MSCI China Utilities ETF
CHIX,GX MSCI China Financials ETF
CHRG,Energy & Minerals Group Battery Materials ETF
CIK,Credit Suisse Asset Management
CIX,Compx International Inc
CKX,Ckx Lands
CLD.W,Calidi Biotherapeutics Inc WT [Cldi.W]
CLDI,Calidi Biotherapeutics Inc
CLDL,Cloud Computing 2X Shares Direxion
CLIA,Veridien Climate Action ETF
CLIP,GX 1-3 Month T-Bill ETF
CLIX,Long Online/Short Stores ETF
CLM,Cornerstone Strategic Value Fund
CLNR,IQ Cleaner Transport ETF
CLOI,Vaneck Clo ETF
CLOX,Panagram AAA Clo ETF
CLOZ,Panagram BBb-B Clo ETF
CLSE,Convergence Long/Short Equity ETF
CMBS,CMBS Ishares ETF
CMCI,Vaneck CMCI Commodity Strategy ETF
CMCL,Caledonia Mining Cp
CMDT,Pimco Commodity Strategy Active ETF
CMDY,Bberg Roll Select cmdty Strategy Ishares ETF
CMF,California Muni Bond Ishares ETF
CMT,Core Molding Technologies Inc
CN,Xt MSCI All China Equity ETF
CNBS,Amplify Seymour Cannabis ETF
CNRG,SPDR Kensho Clean Power ETF
CNXT,Vaneck Chinaamc Sme-Chnext ETF
CNYA,China A Ishares MSCI ETF
COE,51Talk Online Education Group
COHN,Cohen & Company Inc
COM,Auspice Broad Commodity Strategy ETF Direxion
COMB,Commodity Broad Strategy No K-1 ETF
CONY,Yieldmax Coin Option Income ETF
COPX,GX Copper Miners ETF
CORN,Teucrium Corn
CORP,Invst Grade Corp Bd Index Pimco ETF
COWZ,Pacer US Cash Cows 100 ETF
CPER,US Copper
CPHI,China Pharma Holdings
CPI,IQ Real Return ETF
CPII,Ionic Inflation Protection ETF
CQP,Cheniere Energy Partners LP
CQQQ,China Technology Invesco ETF
CRAK,Vaneck Oil Refiners ETF
CRBN,ACWI Low Carbon Target Ishares MSCI ETF
CRDT,Simplify Opportunistic Income ETF
CRED,Columbia Research Enhanced Real Estate ETF
CRF,Cornerstone Strategic Return Fund
CRIT,Optica Rare Earths & Critical Materials ETF
CRPT,FT Skybridge Crypto Industry and Digital Economy
CRTC,Dbx US National Critical Technologies ETF
CRUZ,Defiance Hotel Airline and Cruise ETF
CSD,S&P Spin-Off Invesco ETF
CSHI,Neos Enhanced Income Cash Alternative ETF
CSM,Largecap Core Plus ETF FT
CSMD,Professionally Congress Smid Growth ETF
CTA,Simplify Managed Futures Strategy
CTEX,Proshares S&P Kensho Cleantech ETF
CTGO,Contango Ore Inc
CTM,Castellum Inc
CURE,Healthcare Bull 3X ETF Direxion
CUT,MSCI Global Timber Invesco ETF
CVAR,ETF Opp Cultivar ETF
CVIE,MS International Responsible Index ETF
CVLC,MS US Large-Cap Core Responsible Index ETF
CVM,Cel-Sci Corp
CVMC,MS US Mid-Cap Core Responsible Index ETF
CVR,Chicago Rivet & Machine Company
CVRD,Madison Covered Call ETF
CVRT,Calamos Convertible Equity Alternative ETF
CVSB,MS Ultra-Short Investment Grade ETF
CVSE,MS US Select Equity ETF
CVU,CPI Aerostructures
CVY,Zacks Multi-Asset Income Invesco ETF
CWB,Convertible Secs Barclays Capital SPDR
CWEB,CSI China Internet Idx Bull 2X ETF Direxion
CWI,ACWI Ex-US MSCI ETF SPDR
CWS,Advisorshares Focused Equity ETF
CYA,Simplify Tail Risk Strategy ETF
CYBN,Cybin Inc
CZA,Zacks Midcap Invesco ETF
DALT,Anfield Capital Diversified Alternatives ETF
DAPR,FT U.S. Equity Deep Buffer ETF April
DARP,Grizzle Growth ETF
DAT,Proshares Big Data Refiners ETF
DAUG,FT U.S. Equity Deep Buffer ETF August
DBA,DB Agriculture Fund Invesco
DBAW,Xt MSCI All World Ex US Hedged Equity ETF
DBB,DB Base Metals Fund Invesco
DBC,DB Commodity Index Fund Invesco
DBE,DB Energy Fund Invesco
DBEF,Xt MSCI EAFE Hedged Equity ETF
DBEH,IM Dbi Hedge Strategy ETF
DBEM,Xt MSCI Emerging Markets Hedged Equity ETF
DBEU,Xt MSCI Europe Hedged Equity ETF
DBEZ,Xt MSCI Eurozone Hedged Equity ETF
DBGR,Xt MSCI Germany Hedged Equity ETF
DBJA,Innovator Double Stacker 9 Buffer ETF - Jan
DBJP,Xt MSCI Japan Hedged Equity ETF
DBMF,IM Dbi Managed Futures Strategy ETF
DBND,Doubleline Opportunistic Bond ETF
DBO,DB Oil Fund Invesco
DBP,DB Precious Metals Fund Invesco
DC,Dakota Gold Corp
DC.W,Dakota Gold Corp WT
DCMB,Doubleline Commercial Real Estate ETF
DCOR,Dimensional US Core Equity 1 ETF
DDC,Ddc Enterprise Limited Cl A
DDEC,FT U.S. Equity Deep Buffer ETF December
DDLS,Wisdomtree Dynamic Cur-Hgd Intl Smallcap Equity
DDM,Ultra Dow30 2X ETF
DDWM,Wisdomtree Dynamic Cur-Hgd Intl Equity Fund
DECT,Aim U.S. Large Cap Buffer10 Dec ETF
DECW,Aim U.S. Large Cap Buffer20 Dec ETF
DECZ,Trueshares Structured Outcome [Dec] ETF
DEED,Tcw Securitized Plus ETF FT
DEEF,Xt FTSE Developed Ex US Multifactor ETF
DEEP,Deep Value ETF
DEFI,Teucrium Corn Fund Hashdex Bitcoin Futures ETF
DEHP,Dimensional E.M. High Profitability ETF
DEIF,Northern IV Sterling Capital Diverse ETF
DEM,Wisdomtree EM High Div Fund
DES,Wisdomtree U.S. Smallcap Dividend Fund
DESK,Vaneck Office and Commercial REIT ETF
DEUS,Xt Russell US Multifactor ETF
DEW,Wisdomtree Global High Dividend Fund
DFAC,Dimensional U.S. Core Equity 2 ETF
DFAE,Dimensional W.M. Core Equity Market ETF
DFAI,Dimensional International Core Equity Market ETF
DFAR,Dimensional US Real Estate ETF
DFAS,Dimensional U.S. Small Cap ETF
DFAT,Dimensional U.S. Targeted Value ETF
DFAU,Dimensional US Core Equity Market ETF
DFAW,Dimensional World Equity ETF
DFAX,Dimensional World Ex U.S. Core Equity 2 ETF
DFCA,Dimensional California Municipal Bond ETF
DFCF,Dimensional Core Fixed Income ETF
DFE,Wisdomtree Europe Smallcap Dividend Fund
DFEB,FT U.S. Equity Deep Buffer ETF February
DFEM,Dimensional E.M. Core Equity 2 ETF
DFEN,Aerospace Defense Bull 3X ETF Direxion
DFEV,Dimensional E.M. Value ETF
DFGR,Dimensional Global Real Estate ETF
DFHY,Trimtabs Forlines Tactical High Yield ETF
DFIC,Dimensional Intl Core Equity 2 ETF
DFIP,Dimensional Inflation-Protected Securities ETF
DFIS,Dimensional Intl Small Cap ETF
DFIV,Dimensional International Value ETF
DFJ,Wisdomtree Japan Smallcap Fund
DFLV,Dimensional US Large Cap Value ETF
DFND,Siren Divcon Dividend Defender ETF
DFNL,Davis Select Financial ETF
DFNM,Dimensional National Municipal Bond ETF
DFNV,Trimtabs Forlines Risk Managed Innovation ETF
DFRA,Donoghue Forlines Yield Enhanced Real Asset ETF
DFSB,Dimensional Global Sustainability Fixed Inc ETF
DFSD,Dimensional Short-Duration Fixed Income ETF
DFSE,Dimensional E.M. Sustainability ETF
DFSI,Dimensional International Sustainability ETF
DFSU,Dimensional US Sustainability Core 1 ETF
DFSV,Dimensional US Small Cap Value ETF
DFUS,Dimensional U.S. Equity ETF
DFUV,Dimensional US Marketwide Value ETF
DFVX,Dimensional US Large Cap Vector ETF
DGIN,Vaneck Digital India ETF
DGP,DB Gold 2X ETN Powershares
DGRO,Dividend Growth Ishares Core ETF
DGS,Wisdomtree Emerging Market Smallcap Fund
DGT,Global Dow ETF SPDR
DGZ,DB Gold -1X ETN Powershares
DHS,Wisdomtree U.S. High Dividend Fund
DHY,Credit Suisse High Yield Bond Fund
DIA,Dow Industrials SPDR
DIAL,Columbia Diversified Fixed Income ETF
DIEM,Franklin Emerging Market Core Div Tilt ETF
DIG,Ultra Oil & Gas 2X ETF
DIHP,Dimensional Intl High Profitability ETF
DIM,Wisdomtree International Midcap Dividend Fund
DINT,Davis Select International ETF
DISO,Yieldmax Dis Option Income ETF
DISV,Dimensional Intl Small Cap Value ETF
DIT,Amcon Distributing Company
DIV,GX Super Dividend ETF
DIVB,US Dividend and Buyback Ishares ETF
DIVI,Franklin Intl Core Div Tilt ETF
DIVL,Madison Dividend Value ETF
DIVO,Yieldshares Cwp Dividend & Option Income Amplify
DIVS,Smartetfs Dividend Builder ETF
DIVY,Sound Equity Income ETF
DIVZ,Trueshares Low Volatility Equity Income ETF
DJAN,FT U.S. Equity Deep Buffer ETF January
DJCB,Etracs Commodity Index TR ETN
DJD,Dow Jones Indu Dividend Invesco ETF
DJIA,GX Funds Gx Dow 30 Covered Call ETF
DJP,Ipath Commodity Index TR ETN
DJUL,FT U.S. Equity Deep Buffer ETF July
DJUN,FT U.S. Equity Deep Buffer ETF June
DKRB,Subversive Decarbonization ETF
DLA,Delta Apparel
DLN,Wisdomtree U.S. Largecap Dividend Fund
DLS,Wisdomtree International Smallcap Fund
DMAR,FT U.S. Equity Deep Buffer ETF March
DMAY,FT U.S. Equity Deep Buffer ETF May
DMBS,Doubleline Mortgage ETF
DMCY,Democracy International Fund
DMDV,Aam S&P Dev Markets High Divd Value ETF
DMF,Dreyfus Muni Income
DMY.U,Dmy Squared Technology Group [Dmyy.U]
DMY.W,Dmy Squared Technology Group WT [Dmyy/W]
DMYY,Dmy Squared Technology Group Inc Cl A
DNL,Wisdomtree Global Ex-US Quality Div Growth Fund
DNN,Denison Mines Corp
DNOV,FT U.S. Equity Deep Buffer ETF November
DOCT,FT U.S. Equity Deep Buffer ETF October
DOG,Short Dow30 -1X ETF
DOGG,FT CBOE Vest DJIA Dogs 10 Ta
DOL,Wisdomtree International Largecap Dividend Fund
DON,Wisdomtree U.S. Midcap Dividend Fund
DPSI,Decisionpoint Systems Inc
DPST,Regional Banks Bull 3X Direxion
DRIP,S&P Oil & Gas Expl Bear -2X Direxion
DRLL,Ea Series Strive U.S. Energy ETF
DRN,Real Estate Bull 3X Direxion
DRSK,Aptus Defined Risk ETF
DRUP,Graniteshares Xout U.S. Large Cap ETF
DRV,Real Estate Bear -3X Direxion
DSCF,Discipline Fund ETF
DSEP,FT U.S. Equity Deep Buffer ETF September
DSI,KLD 400 Social Ishares MSCI ETF
DSJA,Innovator Double Stacker ETF - Jan
DSS,Document Security Systems
DSTL,Distillate U.S. Fundamental Stability Value ETF
DTD,Wisdomtree U.S. Total Dividend Fund
DTEC,Alps Disruptive Technologies ETF
DTH,Wisdomtree International High Dividend Fund
DTRE,Alerian Dis Tech Real Estate ETF FT ETF
DUBS,Aptus Large Cap Enhanced Yield ETF
DUDE,Merlyn.Ai Sectorsurfer Momentum ETF
DUG,Ultrashort Oil & Gas -2X ETF
DUHP,Dimensional US High Profitability ETF
DULL,Microsectors Gold -3X Inverse Leveraged ETN
DURA,Vaneck Morningstar Durable Dividend ETF
DUSA,Davis Select USA ETF
DUSB,Dimensional Ultrashort Fixed Income ETF
DUSL,Industrials Bull 3X Direxion
DUST,Gold Miners Bear -2X Direxion
DVDN,Kingsbarn Dividend Opportunity ETF
DVND,Touchstone Dividend Select ETF
DVYA,Asia Pacific Dividend Ishares ETF
DVYE,Emrg Mkts Dividend Ishares ETF
DWAT,Arrow DWA Tactic ETF
DWCR,Arrow DWA Country Rotation ETF
DWLD,Davis Select World Opportunities ETF
DWM,Wisdomtree International Equity Fund
DWMF,Wisdomtree International Multifactor Fund
DWX,S&P Dividend Intl SPDR
DXD,Ultrashort Dow30 -2X ETF
DXF,Dunxin Financial Holdings Ltd ADR
