Symbol,Description
IBDW,Ishares Ibonds Dec 2031 Term Corporate ETF
IBDX,Ishares Ibonds Dec 2032 Term Corporate ETF
IBDY,Ishares Ibonds Dec 2033 Term Corporate ETF
IBHC,Ishares Ibonds 2023 Term High Yield Income ETF
IBHD,Ishares Ibonds 2024 Term High Yield Income ETF
IBHE,Ishares Ibonds 2025 Term High Yield Income ETF
IBHF,Ishares Ibonds 2026 Term High Yield Income ETF
IBHG,Ishares Ibonds 2027 Term High Yield Income ETF
IBHH,Ishares Ibonds 2028 Term High Yield and Income E
IBHI,Ishares Ibonds 2029 Term High Yield and Income E
IBHJ,Ishares Ibonds 2030 Term High Yield and Income E
IBIA,Ishares Trust Ishares Ibonds Oct 2024 Term TIPS
IBIB,Ishares Trust Ishares Ibonds Oct 2025 Term TIPS
IBIC,Ishares Trust Ishares Ibonds Oct 2026 Term TIPS
IBID,Ishares Trust Ishares Ibonds Oct 2027 Term TIPS
IBIE,Ishares Trust Ishares Ibonds Oct 2028 Term TIPS
IBIF,Ishares Ibonds Oct 2029 Term TIPS ETF
IBIG,Ishares Ibonds Oct 2030 Term TIPS ETF
IBIH,Ishares Ibonds Oct 2031 Term TIPS ETF
IBII,Ishares Ibonds Oct 2032 Term TIPS ETF
IBIJ,Ishares Ibonds Oct 2033 Term TIPS ETF
IBIO,Ibio Inc
IBLC,Ishares Blockchain and Tech ETF
IBML,Dec 2023 Term Muni Bond Ishares Ibonds ETF
IBMM,Dec 2024 Term Muni Bond Ishares Ibonds ETF
IBMN,Ishares Ibonds Dec 2025 Term Muni Bond ETF
IBMO,Ishares Ibonds Dec 2026 Term Muni Bond ETF
IBMP,Ishares Ibonds Dec 2027 Term Muni Bond ETF
IBMQ,Ishares Ibonds Dec 2028 Term Muni Bond ETF
IBMR,Ishares Ibonds Dec 2029 Term Muni Bond ETF
IBND,Intl Corp Bond ETF SPDR
IBRN,Ishares Neuroscience and Healthcare ETF
IBUY,Online Retail Amplify ETF
ICAP,Infracap Equity Income Fund ETF
ICF,Cohen & Steers REIT Ishares ETF
ICLO,Invesco AAA Clo Floating Rate Note ETF
ICOW,Pacer Developed Markets International Cash
ICSH,Ultrashort Term Ishares ETF
ICVT,Convertible Bond Ishares ETF
ID,Parts ID Inc
IDAT,Ishares Cloud 5G and Tech ETF
IDEV,Intl Devd Markets Ishares Core MSCI ETF
IDHQ,S&P Intl Developed Quality Invesco ETF
IDLV,S&P Intl Developed Low Vol Invesco ETF
IDMO,S&P Intl Developed Momentum Invesco ETF
IDNA,Genomics Immunology and Healthcare ETF
IDOG,Alps International Sector Dividend
IDR,Idaho Strategic Resources
IDRV,Ishares Self-Driving Ev and Tech ETF
IDU,US Utilities Ishares ETF
IDUB,Aptus International Enhanced Yield ETF
IDV,Intl Select Dividend Ishares ETF
IDVO,Amplify Intl Enhanced Dividend Income ETF
IDX,Vaneck Indonesia Index ETF
IE,Ivanhoe Electric Inc
IEDI,US Discretionary Spending Ishares Evolved ETF
IEFA,EAFE Ishares Core MSCI ETF
IEMG,Emrg Mkts Ishares Core MSCI ETF
IEO,US Oil & Gas Explor & Prod Ishares ETF
IETC,US Technology Ishares Evolved ETF
IEUR,Europe Ishares Core MSCI ETF
IEV,Europe 350 Ishares ETF
IEZ,US Oil Equipment & Services Ishares ETF
IFED,Etracs Ifed Invest With The Fed TR Index ETN
IFRA,US Infrastructure Ishares ETF
IG,Principal Investment Grade Corporate Active ETF
IGBH,Int Rate Hedged Long-Term Corp Bond Ishares ETF
IGC,India Globalization Capital Inc
IGE,Natural Resources North American Ishares ETF
IGEB,Invst Grade Enhanced Bond Ishares Edge ETF
IGHG,Invst Grade-Interest Rate Hedged ETF
IGLB,Long-Term Corp Bond Ishares ETF
IGLD,FT Gold Strategy Target Income ETF
IGM,North American Tech Ishares ETF
IGN,North American Tech-Multimedia Networking ETF
IGPT,Invesco Ai and Next Gen Software ETF
IGRO,Intl Dividend Growth Ishares ETF
IGTR,Innovator Gradient Tactical Rotation ETF
IGV,North American Tech-Software Ishares ETF
IHAK,Ishares Cybersecurity and Tech ETF
IHDG,Wisdomtree Intl Hedged Quality Div Growth ETF
IHE,US Pharmaceuticals Ishares ETF
IHF,US Healthcare Providers Ishares ETF
IHI,US Medical Devices Ishares ETF
IHT,Innsuites Hospitality Trust
IHY,Vaneck International High Yield Bond
IIGD,Invesco Investment Grade Defensive ETF
IJAN,Innovator International Power Buffer ETF - Jan
IJH,S&P Midcap 400 Ishares Core ETF
IJJ,S&P Midcap 400 Value Ishares ETF
IJK,S&P Midcap 400 Growth Ishares ETF
IJR,S&P Smallcap Ishares Core ETF
IJS,S&P Smallcap 600 Value Ishares ETF
IJUL,Innovator International Power Buffer ETF - Jul
ILCB,Mstar Largecap Ishares ETF
ILCG,Mstar Largecap Growth Ishares ETF
ILCV,Mstar Largecap Value Ishares ETF
ILDR,FT Innovation Leaders ETF
ILF,Latin America 40 Ishares ETF
ILTB,10+ Year USD Bond Ishares Core ETF
IMCB,Mstar Midcap Ishares ETF
IMCG,Mstar Midcap Growth Ishares ETF
IMFL,Invesco International Developed Dynamic Multifac
IMO,Imperial Oil Ltd
IMOM,Intl Quantitative Momentum ETF
IMSI,Invesco Municipal Strategic Income Et
IMTB,5-10 Year USD Bond Ishares Core ETF
IMTM,Intl Momentum Factor Ishares Edge MSCI ETF
INC,Vaneck Dynamic High Income ETF
INCM,Franklin Income Focus ETF
INCO,India Consumer Egshares ETF
INDA,India MSCI Ishares ETF
INDE,Matthews India Active ETF
INDF,Nifty India Financials ETF
INDL,India Bull 3X Direxion
INDO,Indonesia Energy Corp Ltd
INDS,Pacer Benchmark Industrial Real Estate ETF
INFL,Horizon Kinetics Inflation Beneficiaries ETF
INFU,Infusystems Holdings
INKM,SSGA Income Allocation ETF SPDR
INLX,Intellinetics Inc
INMU,Blackrock Intermediate Muni Income Bond ETF
INNO,Harbor Disruptive Innovation ETF
INOV,Innovator Intl Developed Power Buf ETF - Nov
INQQ,India Internet & Ecommerce ETF
INTF,Intl Multifactor Ishares Edge MSCI ETF
INTL,Northern Lights Fund Trust IV Main International
INTT,Intest Corp
INUV,Inuvo Inc
IOCT,Innovator International Power Buffer ETF - Oct
ION,Proshares S&P Global Core Battery Metals ETF
IOO,Global 100 Ishares ETF
IOR,Income Opportunity Realty Trust
IPAC,Pacific Ishares Core MSCI ETF
IPAY,ETFMG Prime Mobile Payments ETF
IPB,Merrill Lynch & Company
IPDP,Listed Funds Dividend Performers ETF
IPO,Renaissance IPO ETF
IPOS,Renaissance International IPO ETF
IPPP,Listed Funds Preferred-Plus ETF
IPV.S,Interprivate III Finl Partners [Ipvf.U]
IPV.T,Interprivate III Finl Partners WT [Ipvf/W]
IPVF,Interprivate III Financial Partners Inc Cl A
IQDE,Flexshares Intl Quality Div Def Fund
IQDF,Flexshares Intl Quality Div Fund
IQDG,Wisdomtree Intl Quality Div Growth Fund
IQDY,Flexshares Intl Quality Div Dyn Fund
IQHI,IQ Mackay Municipal Insured ETF
IQIN,IQ 500 International ETF
IQLT,Intl Quality Factor Ishares Edge MSCI ETF
IQM,Franklin Intelligent Machines ETF
IQRA,IQ CBRE Real Assets ETF
IQSI,IQ Candriam ESG International Equity ETF
IQSM,IQ Candriam ESG U.S. Mid Cap Equity ETF
IQSU,IQ Candriam ESG US Equity ETF
IRBA,Imgp Rba Responsible Global Allocation ETF
IRBO,Ishares Robotics and Artificial Intelligence ETF
IRTR,Ishares Lifepath Retirement ETF
IRVH,GX Interest Rate Vol & Inflation Hedge ETF
ISCB,Mstar Smallcap Ishares ETF
ISCF,Intl Smallcap Multifactor Ishares Edge MSCI ETF
ISCG,Mstar Smallcap Growth Ishares ETF
ISCV,Mstar Smallcap Value Ishares ETF
ISDB,Invesco Short-Duration Bond ETF
ISDR,Issuer Direct Corp
ISEP,Innovator International Power Buffer ETF - Sep
ISMD,Inspire Small/Mid Cap Impact ETF
ISRA,Vaneck Israel ETF
ISVL,Ishares Intl Dveloped Small Cap Value Factor ETF
ISWN,Amplify Blackswan Iswn ETF
ISZE,Intl Size Factor Ishares Edge MSCI ETF
ITA,US Aerospace & Defense Ishares ETF
ITAN,Sparkline Intangible Value ETF
ITB,US Home Construction Ishares ETF
ITDA,Ishares Lifepath Target Date 2025 ETF
ITDB,Ishares Lifepath Target Date 2030 ETF
ITDC,Ishares Lifepath Target Date 2035 ETF
ITDD,Ishares Lifepath Target Date 2040 ETF
ITDE,Ishares Lifepath Target Date 2045 ETF
ITDF,Ishares Lifepath Target Date 2050 ETF
ITDG,Ishares Lifepath Target Date 2055 ETF
ITDH,Ishares Lifepath Target Date 2060 ETF
ITDI,Ishares Lifepath Target Date 2065 ETF
ITEQ,Bluestar Israel Technology ETF
ITM,Vaneck Intermediate Muni ETF
ITOT,S&P Total US Stock Market Ishares Core ETF
ITP,IT Tech Packaging Inc
ITRG,Integra Resources Corp
IVAL,Intl Quantitative Valueshares ETF
IVE,S&P 500 Value Ishares ETF
IVES,ETFMG Global Cloud Technology ETF
IVLU,Intl Value Factor Ishares Edge MSCI ETF
IVOG,S&P Midcap 400 Growth ETF Vanguard
IVOL,Quadratic Interest Rate Vol and Infl ETF
IVOO,S&P Midcap 400 ETF Vanguard
IVOV,S&P Midcap 400 Value ETF Vanguard
IVRA,Invesco Real Assets ESG ETF
IVRS,Ishares Future Metaverse Tech and Communications
IVV,S&P 500 Ishares Core ETF
IVVB,Ishares Large Cap Deep Buffer ETF
IVVM,Ishares Large Cap Moderate Buffer ETF
IVW,S&P 500 Growth Ishares ETF
IWB,Russell 1000 Ishares ETF
IWC,Micro-Cap Ishares ETF
IWD,Russell 1000 Value Ishares ETF
IWDL,Etracs 2X US Value Factor TR ETN
IWF,Russell 1000 Growth Ishares ETF
IWFG,IQ Mackay Municipal Insured ETF IQ Winslow Focus
IWFH,Virtual Work and Life Multisector ETF
IWFL,Etracs 2X US Growth Factor TR ETN
IWIN,Amplify Inflation Fighter ETF
IWL,Russell Top 200 Ishares ETF
IWLG,IQ Mackay Municipal Insured ETF IQ Winslow Large
IWM,Russell 2000 Ishares ETF
IWML,Etracs 2X US Size Factor TR ETN
IWMY,Defiance R2000 Enhanced Options Income ETF
IWN,Russell 2000 Value Ishares ETF
IWO,Russell 2000 Growth Ishares ETF
IWP,Russell Midcap Growth Ishares ETF
IWR,Russell Midcap Ishares ETF
IWS,Russell Midcap Value Ishares ETF
IWV,Russell 3000 Ishares ETF
IWX,Russell Top 200 Value Ishares ETF
IWY,Russell Top 200 Growth Ishares ETF
IXC,Global Energy Ishares ETF
IXG,Global Financials Ishares ETF
IXJ,Global Healthcare Ishares ETF
IXN,Global Tech Ishares ETF
IXP,Global Telecom Ishares ETF
IYC,US Consumer Services Ishares ETF
IYE,US Energy Ishares ETF
IYF,US Financials Ishares ETF
IYG,US Financial Services Ishares ETF
IYH,US Healthcare Ishares ETF
IYJ,US Industrials Ishares ETF
IYK,US Consumer Goods Ishares ETF
IYLD,Mstar Multi-Asset Income Ishares ETF
IYM,US Basic Materials Ishares ETF
IYR,US Real Estate Ishares ETF
IYT,Transportation Average Ishares ETF
IYW,US Technology Ishares ETF
IYY,DJ US Ishares ETF
IYZ,US Telecommunications Ishares ETF
IZRL,Ark Israel Innovative Technology ETF
JAAA,Janus AAA Clo ETF
JANT,Allianzim U.S. Large Cap Buffer10 Jan ETF
JANW,Allianzim U.S. Large Cap Buffer20 Jan ETF
JANZ,Trueshares Structured Outcome [Jan] ETF
JAVA,JPM Active Value ETF
JBBB,Janus B-BBB Clo ETF
JBND,JPM Active Bond ETF
JCHI,JPM Active China ETF
JCPB,JPM Core Plus Bond ETF
JCPI,Jpmorgan Inflation Managed Bond Fund
JCTR,JPM Carbon Transition U.S. Equity ETF
JDST,Junior Gold Mine Bear -3X Direxion
JEMA,JPM Emerging Markets ETF
JEPI,JPM Equity Premium Income ETF
JEPY,Defiance S&P 500 Enhanced Options Income ETF
JETD,Max Airlines -3X Inverse Leveraged Etns
JETS,US Global Jets ETF
JETU,Max Airlines 3X Leveraged Etns
JFWD,Jacob Funds Inc Jacob Forward ETF
JGRO,JPM Active Growth ETF
JHAC,JH Fundamental All Cap Core ETF
JHCB,JH Corporate Bond ETF
JHDV,JH U.S. High Dividend ETF
JHEM,JH Multifactor Emerging Markets ETF
JHID,JH International High Dividend ETF
JHMB,JH Mortgage-Backed Securities ETF
JHMD,JH Developed Intl Multifactor ETF
JHML,JH Largecap Multifactor ETF
JHMM,JH Midcap Multifactor ETF
JHMU,JH Dynamic Municipal Bond ETF
JHPI,JH Preferred I ETF
JHSC,JH Multifactor Small Cap ETF
JIB,Janus Sustainable & Impact Bond ETF
JIG,JPM International Growth ETF
JIRE,JPM Intl Research Enhanced Equity ETF
JMBS,Janus Mortgage-Backed Securities ETF
JMEE,JPM Market Expansion Equity ETF
JMHI,JPM High Yield Municipal ETF
JMOM,JPM U.S. Momentum Factor ETF
JMSI,JPM Sustainable Municipal ETF
JMST,JPM Ultra-Short Municipal ETF
JMUB,JPM Municipal ETF
JNK,High Yield Bond ETF SPDR
JNUG,Junior Gold Mine Bull 3X Direxion
JOB,General Employment Enterprises
JOJO,Atac Credit Rotation ETF
JPAN,Matthews Japan Active ETF
JPEM,JPM Dvsd Rtns EM ETF
JPIB,JPM Global Bond Opportunities ETF
JPIE,JPM Income ETF
JPIN,JPM Dvsd Rtns Intl Equity ETF
JPLD,Jpmorgan Limited Duration Bond ETF
JPMB,JPM USD Emrg Mkts Sovereign Bond ETF
JPME,JPM Dvsd Rtns US Midcap ETF
JPMO,Yieldmax JPM Option Income ETF
JPRE,JPM Realty Income ETF
JPSE,JPM Dvsd Rtns US Smallcap Equity ETF
JPST,JPM Ultra-Short Income ETF
JPSV,J.P.M Active Small Cap ETF
JPUS,JPM Dvsd Rtns US Equity ETF
JPXN,Jpx-Nikkei 400 Ishares ETF
JQUA,JPM U.S. Quality Factor ETF
JRE,Janus U.S. Real Estate ETF
JRNY,Alps Global Travel Beneficiaries ETF
JSCP,JPM Short-Duration Core Plus ETF
JSI,Janus Securitized Income ETF
JSTC,Adasina Social Justice All Cap Global ETF
JUCY,Aptus Enhanced Yield ETF
JULD,Innovator Premium Income 10 Barrier ETF - Jul
JULH,Innovator Premium Income 20 Barrier ETF - Jul
JULJ,Innovator Premium Income 30 Barrier ETF - Jul
JULQ,Innovator Premium Income 40 Barrier ETF - Jul
JULT,Allianzim U.S. Large Cap Buffer10 Jul ETF
JULW,Allianzim U.S. Large Cap Buffer20 Jul ETF
JULZ,Trueshares Structured Outcome [Jul] ETF
JUNT,Aim U.S. Large Cap Buffer10 Jun ETF
JUNW,Aim U.S. Large Cap Buffer20 Jun ETF
JUNZ,Trueshares Structured Outcome [Jun] ETF
JUST,GS Just U.S. Large Cap Equity ETF
JVAL,JPM U.S. Value Factor ETF
JWS.S,Jaws Mustang Acquisition Corp [Jwsm.U]
JWS.T,Jaws Mustang Acquisition Corp WT [Jwsm/W]
JWSM,Jaws Mustang Acquisition Corp Cl A
JXI,Global Utilities Ishares ETF
KALL,KS MSCI All China Index ETF
KAPR,Innovator U.S. Smallcap Power Buffer ETF - Apr
KARB,ETF Series Carbon Strategy ETF
KARS,KS Electric Vehicles and Future Mobility ETF
KBA,KS Bosera MSCI China A ETF
KBE,S&P Bank ETF SPDR
KBND,KS Bloomberg Barclays China Bond ETF
KBUY,KS Cicc China Consumer Leaders ETF
KCAL,Subversive Food Security ETF
KCCA,KS California Carbon Allowance ETF
KCE,S&P Capital Markets ETF SPDR
KDIV,KS S&P Pan Asia Dividend Aristo ETF
KDRN,ETF Opp Kingsbarn Tactical Bond ETF
KEM,KS Dynamic Emerging Markets Strategy ETF
KEMQ,KS EM Consumer Technology Index ETF
KEMX,KS MSCI Emerging Markets Ex China Index ETF
KEUA,KS European Carbon Allowance ETF
KFVG,KS Cicc China 5G and Semiconductor ETF
KGRN,KS MSCI China Environment Index ETF
KGRO,KS China Innovation ETF
KHYB,KS Ccbs China Corp High Yield Bond USD ETF
KIE,S&P Insurance ETF SPDR
KIQ,Kelso Technologies
KJAN,Innovator U.S. Smallcap Power Buffer ETF - Jan
KJUL,Innovator U.S. Smallcap Power Buffer ETF - Jul
KLDW,Knowledge Leaders Developed World ETF
KLIP,KS China Internet and Covered Call Strategy ETF
KLNE,Daily Global Clean Energy Bull 2X ETF Direxion
KLXY,KS Global Luxury Index ETF
KMET,KS Electrification Metals Strategy ETF
KMLM,Kfa Mount Lucas Index Strategy ETF
KNCT,Invesco Next Gen Connectivity ETF
KNG,CBOE S&P 500 Dividend Aristocrats Target Income
KNGS,Roundhill S&P Dividend Monarchs ETF
KNW,Know Labs Inc
KOCG,Fis Knights of Columbus Global Belief ETF
KOCT,Innovator U.S. Smallcap Power Buffer ETF - Oct
KOIN,Innovation Nextgen Protocol ETF
KOKU,Xt MSCI Kokusai Equity ETF
KOLD,Ultrashort Bloomberg Natural Gas -2X ETF
KOMP,SPDR Kensho & New Economies Composite ETF
KONG,Opportunities Formidable Fortress ETF
KORP,American Century Dvfd Corp Bond ETF
KORU,South Korea Bull 3X Direxion
KPOP,Kpop and Korean Entertainment ETF
KRBN,Kfa Global Carbon ETF
KRE,S&P Regional Banking ETF SPDR
KRUZ,Unusual Whales Republican Trades ETF
KSA,Saudi Arabia Ishares MSCI ETF
KSEA,KS Rockefeller Ocean Engagement ETF
KSET,KS Global Carbon Offset Strategy ETF
KSTR,KS Sse Star Market 50 Index ETF
KTEC,KS Hang Seng Tech Index ETF
KULR,Kulr Technology Group Inc
KURE,KS MSCI All China Health Care Index ETF
KVLE,KS Kfa Value Line Dynamic Core Equity ETF
KWEB,KS CSI China Internet ETF
KWT,Ishares MSCI Kuwait ETF
KXI,Global Cons Staples Ishares ETF
LABD,S&P Biotech Bear -3X Direxion
LABU,S&P Biotech Bull 3X Direxion
LALT,FT Multi-Strategy ETF
LBAY,Leatherback Long/Short Alternative Yield ETF
LCF,Touchstone US Large Cap Focused ETF
LCG,Sterling Capital Focus Equity ETF
LCLG,Logan Capital Broad Innovative Growth ETF
LCR,Leuthold Core ETF
LCTD,Blackrock World Ex U.S. Carbon Transition ETF
LCTU,Blackrock U.S. Carbon Transition Readiness ETF
LCTX,Lineage Cell Therapeutics Inc
LDUR,Pimco Low Duration ETF
LEAD,Siren Divcon Leaders Dividend ETF
LEMB,Emrg Mkts Local Curr Bond Ishares JPM ETF
LEU,Centrus Energy Corp
LEXI,Alexis Practical Tactical ETF
LFEQ,Vaneck Long/Flat Trend ETF
LGH,Hcm Defender 500 Index ETF
LGL,LGL Group
LGL.W,LGL Group Inc WT
LGLV,SSGA US Large Cap Low Vol Index SPDR
LGLZ,Tidal Subversive Cannabis ETF
LGOV,FT Long Duration Opportunities ETF
LIT,GX Lithium & Battery Tech ETF
LKOR,Flexshares Credit Scored US Long Corp
LMN.W,Lemonade Inc WT [Lmnd/W]
LNG,Cheniere Energy
LNGG,Roundhill Alerian Lng ETF
LOCT,Innovator Premium Income 15 Buffer ETF - Oct
LODE,Comstock Inc
LONZ,Pimco Senior Loan Active Exchange
LOPP,Gabelli Love Our Planet & People ETF
LOUP,Innovator Deepwater Frontier Tech ETF
LOWV,Ab US Low Volatility Equity ETF
LPTV,Loop Media Inc
LQAI,Lg Qraft Ai-Powered U.S. Large Cap Core ETF
LQD,Invst Grade Corp Bond Ishares Iboxx $ ETF
LQDB,Ishares BBB Rated Corporate Bond ETF
LQDH,Int Rate Hedged Corp Bond Ishares ETF
LQDI,Ishares Inflation Hedged Corporate Bond ETF
LQDW,Ishares Invt Grade Corp Bond Buywrite Strategy E
LQIG,SPDR Marketaxess Investment Grade 400 Corporate
LRGC,Ab US Large Cap Strategic Equities ETF
LRGF,USA Multifactor Ishares Edge MSCI ETF
LRNZ,Truemark Technology Ai & Deep Learning ETF
LSAF,Leadershares Alphafactor US Core Equity ETF
LSAT,Leadershares Alphafactor Tactical Focused ETF
LSF,Laird Superfood Inc
LSGR,Natixis Loomis Sayles Focused Growth ETF
LSST,Natixis Loomis Sayles Short-Duration Income ETF
LTL,Ultra Telecommunications 2X ETF
LTPZ,15+ Year US TIPS Index Pimco ETF
LUX,Tema Luxury ETF
LUXX,Roundhill S&P Global Luxury ETF
LVHI,Legg Intl Low Vol High Div ETF
LVOL,American Century Low Volatility ETF
MAG,MAG Silver Corp
MAGA,Point Bridge Gop Stock Tracker ETF
MAGG,Madison ETFS Trust Madison Aggregate Bond ETF
MAIA,Maia Biotechnology Inc
MAKX,Proshares S&P Kensho Smart Factories ETF
MAMB,Monarch Ambassador Income ETF
MAPP,Harbor Multi-Asset Explorer ETF
MARB,Merger Arbitrage ETF FT
MART,Allianzim U.S. Large Cap Buffer10 Mar ETF
MARW,Allianzim U.S. Large Cap Buffer20 Mar ETF
MARZ,Trueshares Structured Outcome [Mar] ETF
MAYT,Aim U.S. Large Cap Buffer10 May ETF
MAYW,Aim U.S. Large Cap Buffer20 May ETF
MAYZ,Listed Funds Trust Trueshares Structured Outcome
MBBB,Vaneck Moody's BBB Corp Bond ETF
MBCC,Monarch Blue Chips Core ETF
MBND,SPDR Nuveen Municipal Bond ETF
MBNE,SPDR Nuveen Municipal Bond ESG ETF
MBOX,Freedom Day Dividend ETF
MBSD,Flexshares Disciplined Duration MBS Index Fund
MCH,Matthews China Active ETF
MDEV,Indxx Medical Devices ETF FT
MDLV,Ea Series Trust Morgan Dempsey Large Cap Value E
MDY,S&P Midcap 400 SPDR
MDYG,S&P Midcap Growth ETF SPDR
MDYV,S&P Midcap Value ETF SPDR
MEAR,Short Maturity Muni Bond Ishares ETF
MEDI,Harbor Health Care ETF
MEM,Matthews Emerging Markets Equity Active ETF
MEME,Listed Roundhill Meme ETF
MEMX,Matthews Emerging Markets Ex China ETF
METV,Roundhill Ball Metaverse ETF
MEXX,MSCI Mexico Bull 3X Direxion
MFDX,Pimco RAFI Multi-Factor Intl ETF
MFEM,Pimco RAFI Multi-Factor EM ETF
MFUL,Mindful Conservative ETF
MFUS,Pimco RAFI Multi-Factor U.S. Equity ETF
MGC,Vanguard Mega Cap ETF
MGK,Vanguard Mega Cap Growth ETF
MGLD,Marygold Company Inc
MGMT,Ballast Small/Mid Cap ETF
MGOV,FT Intermediate Government Opportunities ETF
MGV,Vanguard Mega Cap Value ETF
MHH,Mastech Holdings Inc
MI,Nft Limited Class A Ordinary Share
MID,American Century Mid Cap Growth Impact ETF
MIDE,Xt S&P Midcap 400 ESG ETF
MIDU,Mid Cap Bull 3X Direxion
MIG,Vaneck Moody's IG Corp Bond ETF
MIMO,Airspan Networks Holdings Inc
MINN,Trust For Professional Managers Mairs & Power
MINO,Pimco Municipal Income Opportunities Active ETF
MINT,Enhanced Short-Maturity Strgy Pimco ETF
MINV,Matthews Asia Innovators Active ETF
MISL,FT Indxx Aerospace & Defence ETF
MITQ,Moving Image Technologies Inc
MJ,ETFMG Alternative Harvest ETF
MJUS,ETFMG U.S. Alternative Harvest ETF
MKOR,Matthews Korea Active ETF
MLN,Vaneck Vaneck Corp Long Muni ETF
MLPA,GX MLP ETF
MLPB,Etracs MLP Infrastructure Index ETN
MLPO,CS S&P MLP Index ETN
MLPR,Etracs Quarterly Pay 1.5X Alerian MLP ETN
MLPX,GX MLP & Energy Infrastructure ETF
MLSS,Milestone Scientific
MMCA,IQ Mackay California Municipal Intermediate ETF
MMIN,IQ Mackay Shields Municipal Insured ETF
MMIT,IQ Mackay Municipal Intermediate ETF
MMLG,Multi-Manager Large Growth ETF FT
MMSB,IQ Mackay Multi-Sector Income ETF
MMSC,FT Multi-Manager Small Cap Opportunities ETF
MMTM,S&P 1500 Momentum Tilt ETF SPDR
MNA,IQ Merger Arbitrage ETF
MNBD,Alps Intermediate Municipal Bond ETF
MOAT,Vaneck Morningstar Wide Moat ETF
MOHR,Mohr Growth ETF
MOO,Vaneck Agribusiness ETF
MOOD,Alpha Architect Relative Sentiment ETF
MOON,Direxion Moonshot Innovators ETF
MORT,Vaneck Mortgage REIT Income ETF
MOTE,Vaneck Morningstar ESG Moat ETF
MOTG,Vaneck Morningstar Global Wide Moat ETF
MOTI,Vaneck Mstar International Moat ETF
MOTO,Smartetfs Smart Transport & Tech ETF
MPAY,Akros Monthly Payout ETF
MPRO,Northern IV Monarch Procap ETF
MPTI,M-Tron Industries Inc
MPU,Mega Matrix Corp
MRAD,Smartetfs Advertising & Marketing Technology ETF
MRGR,Merger ETF
MRNY,Yieldmax Mrna Option Income ETF
MRSK,Agility Shares Managed Risk ETF
MRT,Marti Technologies Inc
MRT.W,Marti Technologies Inc WT
MSFO,Yieldmax Msft Option Income ETF
MSFY,Neos Yield Premium Strategy Microsoft [Msft] ETF
MSMR,ETF Series Mcelhenny Sheffield Managed
MSN,Emerson Radio Corp
MSOS,Advisorshares Pure US Cannabis ETF
MSOX,Advisorshares Msos 2X Daily ETF
MSTB,Lha Market State Tactical Beta ETF
MSTI,Madison Short Term Strategic Income ETF
MSTQ,Lha Market State Tactical Q ETF
MSVX,Lha Market State Alpha Seeker ETF
MTA,Metalla Royalty and Streaming Ltd
MTBA,Simplify MBS ETF
MTGP,Wisdomtree Mortgage Plus Bond Fund
MTNB,Matinas Biopharma Hl
MTUL,Etracs 2X MSCI US Momentum Factor TR ETF
MTUM,USA Momentum Factor Ishares Edge MSCI ETF
MUB,Natl Muni Bond Ishares ETF
MUNI,Interm Muni Bond Strgy Pimco ETF
MUSI,American Century Multisector Income ETF
MUSQ,Musq Global Music Industry ETF
MUST,Columbia Multi-Sector Municipal Income ETF
MVPS,Amplify Thematic All-Stars ETF
MVRL,Etracs Monthly Pay 1.5X Mortgage REIT ETN
MVV,Ultra Midcap400 2X ETF
MWG,Multi Ways Holdings Limited
MXC,Mexco Energy Corp
MXI,Global Materials Ishares ETF
MYO,Myomo Inc
MYY,Short Midcap400 -1X ETF
MZZ,Ultrashort Midcap400 -2X ETF
NACP,Impact Shares Naacp Minority Empowerment ETF
NAIL,Homebuild & Suppliers Bull 3X Direxion
NAK,Northern Dynasty Minerals
NANC,Unusual Whales Democratic Trades ETF
NANR,S&P North American Natural SPDR
NAPR,Innovator Growth-100 Power Buffer ETF - Apr
NBCC,Neuberger Next Generation Connected Consumer ETF
NBCE,Neuberger China Equity ETF
NBCM,Neuberger Commodity Strategy ETF
NBCT,Neuberger Carbon Transition Infrastructure ETF
NBDS,Neuberger Disrupters ETF
NBGR,Neuberger Global Real Estate ETF
NBH,Neuberger Berman Intermediate Fund Inc
NBY,Novabay Pharmaceuticals
NCL,Northann Corp
NDIA,GX X India Active ETF
NDIV,Amplify Natural Resources Dividend Income ETF
NDJI,ETF Dow Jones Risk-Managed Income ETF
NDVG,Nuveen Dividend Growth ETF
NEAR,Short Maturity Bond Ishares ETF
NEN,New England Realty Associates Ltd Partnershi
NERD,Roundhill Esports & Digital Entertainment ETF
NETL,Netlease Corporate Real Estate ETF
NETZ,Tcw Transform Climate ETF
NEWP,New Pacific Metals Corp
NFGC,New Found Gold Corp
NFLP,Neos Strategy Netflix [Nflx] ETF
NFLT,Virtus Newfleet Multi-Sector Bond ETF
NFLY,Yieldmax Nflx Option Income ETF
NFRA,Flexshares Global Broad Infr Fund
NG,Novagold Resources Inc
NGD,New Gold Inc
NGE,GX MSCI Nigeria ETF
NHC,National Healthcare Corp
NHS,Neuberger Berman High Yield Strategies
NHWK,Nighthawk Biosciences Inc
NJAN,Innovator Growth-100 Power Buffer ETF - Jan
NJUL,Innovator Growth-100 Power Buffer ETF - Jul
NLR,Vaneck Uranium & Nuclear Energy ETF
NML,Neuberger Berman Energy Infra and Inc Fund
NNVC,Nanoviricides Inc
NOBL,S&P 500 Dividend Aristocrats ETF
NOCT,Innovator Growth-100 Power Buffer Etf- Oct
NORW,GX FTSE Nordic Region ETF
NOVZ,Trueshares Structured Outcome [Nov] ETF
NRGD,Microsectors U.S. Big Oil Index -3X ETN
NRGU,Microsectors U.S. Big Oil Index 3X ETN
NRO,Neuberger Berman Real Estate Securities
NRXS,Neuraxis Inc
NSCS,Nuveen Small Cap Select ETF
NSPI,ETF S&P 500 Risk-Managed Income ETF
NST.U,Northern Star Invt Corp II [Nstb.U]
NST.W,Northern Star Invt Corp II [Nstb/W]
NSTB,Northern Star Investment Corp II Cl A
NTIP,Network-1 Sec Solu
NTKI,ETF Russell 2000 Risk-Managed Income ETF
NTRL,Global X Funds Global X Carbon Credits Strategy
NTSE,Wisdomtree Emerging Markets Efficient Core Fund
NTSI,Wisdomtree Intl Efficient Core Fund
NTSX,Wisdomtree U.S. Efficient Core Fund
NUAG,Nushares US Aggregate Bond ETF
NUBD,Nushares ESG U.S. Aggregate Bond ETF
NUDM,Nushares ESG Intl Developed Markets Equity ETF
NUDV,Nuveen ESG Dividend ETF
NUEM,Nushares ESG Emerging Markets Equity ETF
NUGO,Nuveen Growth Opportunities ETF
NUGT,Gold Miners Bull 2X ETF Direxion
NUHY,Nuveen ESG High Yield Corporate Bond ETF
NULC,Nushares ETF Trust
NULG,Nushares ESG Largecap Growth ETF
NULV,Nushares ESG Largecap Value ETF
NUMG,Nushares ESG Midcap Growth ETF
NUMV,Nushares ESG Midcap Value ETF
NURE,Nushares Short-Term REIT ETF
NUSA,1-5 Year U.S. Aggregate Nushares ETF
NUSC,Nushares ESG Smallcap ETF
NUSI,Nationwide Risk-Managed Income ETF
NVBT,Allianzim U.S. Large Cap Buffer10 Nov ETF
NVBW,Allianzim U.S. Large Cap Buffer20 Nov ETF
NVDQ,T-Rex 2X Inverse Nvidia Daily Target ETF
NVDX,T-Rex 2X Long Nvidia Daily Target ETF
NVDY,Yieldmax Nvda Option Income ETF
NVIR,Horizon Kinetics Energy and Remediation ETF
NVQ,Qraft Ai-Enhanced US Next Value ETF
NWLG,Nuveen Winslow Largecap Growth ESG ETF
NXTE,Axs Green Alpha ETF
NYF,New York Muni Bond Ishares ETF
OACP,Oneascent Core Plus Bond ETF
OAEM,Oneascent Emerging Markets ETF
OAIA,Teucrium Aila Long-Short Agriculture Strategy
OAIB,Teucrium Aila Long/Short Base Metals Strategy Et
OAIE,Optimize Ai Smart Sentiment Event-Driven
